question,answer,generate_answer
Chương trình đào tạo ngành Công nghệ kỹ thuật cơ điện tử của Trường Đại học Công nghệ yêu cầu bao nhiêu tín chỉ?,135 tín chỉ.,"149 tín chỉ (không tính các học phần Giáo dục thể chất, Giáo dục quốc phòng - an ninh và Kỹ năng bổ trợ) hoặc 134 tín chỉ (không tính các học phần Giáo dục thể"
Khối kiến thức chung trong chương trình đào tạo ngành Công nghệ kỹ thuật cơ điện tử của Trường Đại học Công nghệ chiếm bao nhiêu tín chỉ?,26 tín chỉ.,21 tín chỉ
Môn Triết học Mác - Lênin thuộc khối kiến thức nào trong chương trình đào tạo ngành Công nghệ kỹ thuật cơ điện tử của Trường Đại học Công nghệ?,Khối kiến thức chung.,Không biết
Môn Kinh tế chính trị Mác - Lênin có môn tiên quyết là gì trong chương trình đào tạo ngành Công nghệ kỹ thuật cơ điện tử của Trường Đại học Công nghệ?,Triết học Mác – Lênin.,Không biết
Môn Giải tích 2 có môn tiên quyết là gì trong chương trình đào tạo ngành Công nghệ kỹ thuật cơ điện tử của Trường Đại học Công nghệ?,Giải tích 1.,Không biết
Môn Cơ học kỹ thuật 2 có môn tiên quyết là gì trong chương trình đào tạo ngành Công nghệ kỹ thuật cơ điện tử của Trường Đại học Công nghệ?,Cơ học kỹ thuật 1.,Không biết
Môn Sức bền vật liệu và cơ học kết cấu có môn tiên quyết là gì trong chương trình đào tạo ngành Công nghệ kỹ thuật cơ điện tử của Trường Đại học Công nghệ?,Cơ học kỹ thuật 2.,Không biết
Sinh viên ngành Công nghệ kỹ thuật cơ điện tử của Trường Đại học Công nghệ được học những kiến thức chuyên sâu nào?,"Hệ thống cơ điện tử, Chế tạo thiết bị, Đo lường và điều khiển, Công nghệ màn hình tiên tiến, Hệ thống vi cơ điện tử và nanô cơ điện tử, Kỹ thuật robot.",- Định hướng chuyên sâu về Hệ thống cơ điện tử:
Môn Hệ thống cơ điện tử có những môn tiên quyết nào trong chương trình đào tạo ngành Công nghệ kỹ thuật cơ điện tử của Trường Đại học Công nghệ?,Cơ học kỹ thuật 2 và Vật lý đại cương 2.,Không biết
Môn Vi xử lý và vi điều khiển có những môn tiên quyết nào trong chương trình đào tạo ngành Công nghệ kỹ thuật cơ điện tử của Trường Đại học Công nghệ?,Nguyên lý kỹ thuật điện tử và Linh kiện bán dẫn và vi mạch.,Không biết
Môn Điều khiển PLC có những môn tiên quyết nào trong chương trình đào tạo ngành Công nghệ kỹ thuật cơ điện tử của Trường Đại học Công nghệ?,"Cơ sở kỹ thuật điện, Kỹ thuật đo lường và cảm biến, và Nguyên lý kỹ thuật điện tử.",Không biết
Môn SCADA có những môn tiên quyết nào trong chương trình đào tạo ngành Công nghệ kỹ thuật cơ điện tử của Trường Đại học Công nghệ?,Điều khiển PLC và Kiến trúc máy tính và mạng truyền thông công nghiệp.,Không biết
Sinh viên ngành Công nghệ kỹ thuật cơ điện tử của Trường Đại học Công nghệ phải thực tập bao nhiêu tín chỉ?,7 tín chỉ.,Không biết
Sinh viên ngành Công nghệ kỹ thuật cơ điện tử của Trường Đại học Công nghệ phải làm khóa luận tốt nghiệp bao nhiêu tín chỉ?,7 tín chỉ.,Không biết
"Các học phần có mã học phần thêm chữ ""E"" được giảng dạy bằng ngôn ngữ gì tại Trường Đại học Công nghệ?",Tiếng Anh.,"Các học phần có mã học phần thêm chữ ""E"" được giảng dạy bằng tiếng Anh. "
Sinh viên tốt nghiệp ngành Công nghệ Hàng không Vũ trụ tại Trường Đại học Công nghệ cần có kiến thức gì về lý luận chính trị?,Cần trình bày được hệ thống tri thức khoa học những nguyên lý cơ bản của Chủ nghĩa Mác Lênin.,Không biết
Sinh viên tốt nghiệp ngành Công nghệ Hàng không Vũ trụ tại Trường Đại học Công nghệ cần đạt trình độ ngoại ngữ tối thiểu nào?,Đạt trình độ tối thiểu tương đương bậc 3 theo Khung năng lực ngoại ngữ 6 bậc dùng cho Việt Nam.,Không biết
Sinh viên tốt nghiệp ngành Công nghệ Hàng không Vũ trụ tại Trường Đại học Công nghệ cần có kiến thức về tin học như thế nào?,"Cần có khả năng phân tích, đánh giá và sử dụng một ngôn ngữ lập trình bậc cao.",Sinh viên tốt nghiệp ngành Công nghệ Hàng không Vũ trụ tại Trường Đại học Công nghệ cần có kiến thức về tin học bao gồm:
Sinh viên ngành Công nghệ Hàng không Vũ trụ tại Trường Đại học Công nghệ cần có kỹ năng nghề nghiệp gì?,Có kỹ năng hoàn thành công việc phức tạp đòi hỏi vận dụng kiến thức lý thuyết và thực tiễn của ngành được đào tạo.,Sinh viên ngành Công nghệ Hàng không Vũ trụ tại Trường Đại học Công nghệ cần có các kỹ năng nghề nghiệp sau:
Sinh viên ngành Công nghệ Hàng không Vũ trụ tại Trường Đại học Công nghệ cần có phẩm chất đạo đức cá nhân như thế nào?,"Cần trung thực, lễ độ, khiêm tốn, nhiệt tình.","Sinh viên ngành Công nghệ Hàng không Vũ trụ tại Trường Đại học Công nghệ cần có phẩm chất đạo đức cá nhân tốt, chuẩn mực trong lời nói, hành vi, thân thiện với bạn bè đồng nghiệp, có tinh thần tự học"
Sinh viên ngành Công nghệ Hàng không Vũ trụ tại Trường Đại học Công nghệ cần có phẩm chất đạo đức nghề nghiệp gì?,Cần có trách nhiệm với công việc và trung thành với tổ chức.,Không biết
Sinh viên ngành Công nghệ Hàng không Vũ trụ tại Trường Đại học Công nghệ cần có phẩm chất đạo đức xã hội gì?,"Cần có trách nhiệm với xã hội, tuân thủ luật pháp và có ý thức phục vụ.",Không biết
Kỹ sư ngành Công nghệ Hàng không Vũ trụ sau khi tốt nghiệp tại Trường Đại học Công nghệ có thể đảm nhiệm vị trí công tác nào?,"Kỹ sư thiết kế, chế tạo các thiết bị bay, vệ tinh.",Sinh viên ngành Công nghệ Hàng không Vũ trụ sau khi tốt nghiệp tại Trường Đại học Công nghệ có khả năng tham mưu tư vấn và có năng lực thực hiện nhiệm vụ với tư cách như một kỹ sư trong lĩnh vực Hàng không Vũ
Kỹ sư ngành Công nghệ Hàng không Vũ trụ sau khi tốt nghiệp tại Trường Đại học Công nghệ có thể làm gì liên quan đến hệ thống điều khiển?,"Kỹ sư thiết kế, lập trình các hệ thống điều khiển, hệ thống nhúng.","Kỹ sư ngành Công nghệ Hàng không Vũ trụ sau khi tốt nghiệp tại Trường Đại học Công nghệ có thể tham gia các khóa học nâng cao ngắn hạn về Điều khiển, từ đó có thể áp dụng kiến thức về hệ thống điều khiển"
Sinh viên tốt nghiệp ngành Công nghệ Hàng không Vũ trụ tại Trường Đại học Công nghệ có kiến thức gì về vật lý?,"Hiểu và vận dụng được các kiến thức cơ bản về vật lý cơ, nhiệt, điện và quang.",Không biết
Sinh viên tốt nghiệp ngành Công nghệ Hàng không Vũ trụ tại Trường Đại học Công nghệ cần nắm vững kiến thức gì về Giải tích toán học?,"Nắm được các kiến thức liên quan đến Giải tích toán học như tính giới hạn, tính đạo hàm, tính tích phân của các hàm một biến và hàm nhiều biến.",Không biết
Sinh viên tốt nghiệp ngành Công nghệ Hàng không Vũ trụ tại Trường Đại học Công nghệ cần hiểu và vận dụng kiến thức gì về Đại số cao cấp?,"Hiểu và vận dụng được các kiến thức liên quan đến Đại số cao cấp như ma trận và các phép biến đổi, giải các hệ phương trình nhiều biến số.",
"Sinh viên tốt nghiệp ngành Công nghệ Hàng không Vũ trụ tại Trường Đại học Công nghệ cần nắm được kiến thức cơ bản nào về kỹ thuật điện, điện tử?","Nắm được các kiến thức cơ bản trong kỹ thuật điện, điện tử; Có khả năng thiết kế các mạch điện, điện tử thông dụng.",Tôi không biết
Sinh viên tốt nghiệp ngành Công nghệ Hàng không Vũ trụ định hướng Công nghệ thông tin và Điện tử Hàng không tại Trường Đại học Công nghệ cần có kiến thức gì về viễn thám?,"Có kiến thức cơ bản về viễn thám, hệ thống thông tin địa lý, các kỹ thuật xử lý ảnh viễn thám, phân tích không gian, phát triển ứng dụng 3D trên nền bản đồ địa lý, quản lý dữ liệu không gian, xây dựng hạ tầng thông tin không gian.","Có kiến thức cơ bản về viễn thám, hệ thống thông tin địa lý, các kỹ thuật xử lý ảnh viễn thám, phân tích không gian, phát triển ứng dụng 3D trên nền bản đồ địa lý, quản"
"Sinh viên tốt nghiệp ngành Công nghệ Hàng không Vũ trụ định hướng Động lực học, Điều khiển và Cơ khí Hàng không tại Trường Đại học Công nghệ cần thành thạo kỹ năng gì về cơ khí?","Thành thạo các kỹ năng về cơ khí chế tạo, động lực học và mô hình hóa mô phỏng các thiết bị và hoạt động trong kỹ thuật hàng không vũ trụ, phân tích dữ liệu và nhận dạng hệ thống.",Không biết
Sinh viên tốt nghiệp ngành Kỹ thuật năng lượng có thể làm việc ở vị trí nào liên quan đến năng lượng tái tạo?,"Vị trí phát triển và triển khai các nguồn năng lượng tái tạo như năng lượng mặt trời, năng lượng gió, năng lượng từ nước, hay năng lượng sinh học.","- Phát triển và triển khai các nguồn năng lượng tái tạo như năng lượng mặt trời, năng lượng gió, năng lượng từ nước, hay năng lượng sinh học."
Kỹ sư quản lý năng lượng làm gì?,Phân tích và cải thiện hiệu suất năng lượng của các hệ thống và đề xuất các biện pháp tiết kiệm năng lượng.,Kỹ sư quản lý năng lượng đảm bảo việc chuyển giao năng lượng từ các nguồn sản xuất đến người dùng cuối cùng một cách hiệu quả và ổn định. Vị trí này quản lý các dự án năng lượng từ khâu lập kế hoạch
Kỹ sư năng lượng đảm bảo điều gì trong hệ thống truyền tải và phân phối năng lượng?,Đảm bảo việc chuyển giao năng lượng từ các nguồn sản xuất đến người dùng cuối cùng một cách hiệu quả và ổn định.,Kỹ sư năng lượng đảm bảo việc chuyển giao năng lượng từ các nguồn sản xuất đến người dùng cuối cùng một cách hiệu quả và ổn định. 
Kỹ sư chuyên ngành quản lý dự án năng lượng có trách nhiệm gì?,Phối hợp với các bộ phận liên quan để đảm bảo các dự án được hoàn thành đúng tiến độ và đạt được hiệu quả kinh tế.,Kỹ sư chuyên ngành quản lý dự án năng lượng có trách nhiệm phối hợp với các bộ phận liên quan để đảm bảo các dự án được hoàn thành đúng tiến độ và đạt được hiệu quả kinh tế. 
Chuyên viên nghiên cứu và phát triển năng lượng làm việc ở đâu?,"Trong các trung tâm nghiên cứu, trường đại học hoặc các công ty công nghệ.","Chuyên viên nghiên cứu và phát triển năng lượng thường làm việc trong các trung tâm nghiên cứu, trường đại học hoặc các công ty công nghệ. "
Sinh viên tốt nghiệp ngành Kỹ thuật năng lượng có thể đảm nhiệm vị trí giảng viên ở đâu?,Tại các cơ sở giáo dục đào tạo phổ thông và đại học.,Tôi không biết
Người học sau tốt nghiệp ngành Kỹ thuật năng lượng thường làm việc ở đâu trong lĩnh vực tư vấn năng lượng?,Trong các công ty tư vấn hoặc công ty năng lượng.,"Người học sau tốt nghiệp ngành Kỹ thuật năng lượng thường làm việc trong các công ty tư vấn hoặc công ty năng lượng, cung cấp dịch vụ tư vấn về tiết kiệm năng lượng, cải thiện hiệu suất năng lượng và đưa ra các giải"
Kỹ sư ngành Kỹ thuật năng lượng có thể học lên bậc cao học ở những chuyên ngành nào?,"Các chuyên ngành về năng lượng tái tạo, năng lượng truyền thống, vật liệu và linh kiện, khoa học vật liệu, vật lí ứng dụng…","Kỹ sư ngành Kỹ thuật năng lượng có thể học lên bậc cao học ở các chuyên ngành liên quan đến năng lượng mới, vật liệu và linh kiện nano, vật liệu điện tử, và các chuyên ngành khác như năng lượng"
PLO1 của ngành Kỹ thuật năng lượng đề cập đến kiến thức gì?,"Kiến thức cơ bản về khoa học xã hội, về khoa học chính trị và pháp luật; về văn hóa, xã hội và nhân văn; về rèn luyện thể chất và quốc phòng.",Không biết
PLO2 của ngành Kỹ thuật năng lượng đề cập đến kiến thức gì?,"Kiến thức cơ bản của Toán học, khoa học cơ bản, và CNTT để giải quyết các bài toán liên quan đến lĩnh vực kỹ thuật.",Không biết
PLO3 của ngành Kỹ thuật năng lượng đề cập đến kiến thức gì?,Kiến thức cơ bản về quản lý điều hành hoạt động chuyên môn.,PLO3: Vận dụng được kiến thức cơ bản về quản lý điều hành hoạt động chuyên môn.
PLO10 của ngành Kỹ thuật năng lượng yêu cầu trình độ tiếng Anh như thế nào?,Tương đương trình độ bậc 3 (theo Khung năng lực ngoại ngữ 6 bậc dùng cho Việt Nam).,PLO10: Có trình độ tiếng Anh tương đương trình độ bậc 3 (theo Khung năng lực ngoại ngữ 6 bậc dùng cho Việt Nam). 
PLO11 của ngành Kỹ thuật năng lượng yêu cầu khả năng gì?,"Có khả năng đề xuất giải pháp về lĩnh vực kỹ thuật Năng lượng bằng cách áp dụng các kiến thức khoa học, CNTT, các công cụ và công nghệ hiện đại.","PLO11: Có khả năng đề xuất giải pháp về lĩnh vực kỹ thuật Năng lượng bằng cách áp dụng các kiến thức khoa học, CNTT, các công cụ và công nghệ hiện đại. "
PLO13 của ngành Kỹ thuật năng lượng yêu cầu khả năng gì?,"Có khả năng xây dựng kế hoạch và quản lý tiết kiệm năng lượng của mạng lưới phân phối và công ty, thiết kế và vận hành hệ thống cung cấp điện và năng lượng nhiệt và giải quyết các nhiệm vụ tài chính.","PLO13: Có khả năng xây dựng kế hoạch và quản lý tiết kiệm năng lượng của mạng lưới phân phối và công ty, thiết kế và vận hành hệ thống cung cấp điện và năng lượng nhiệt và giải quyết các nhiệm vụ tài"
PLO19 của ngành Kỹ thuật năng lượng đề cập đến điều gì?,"Chủ động tuân thủ pháp luật, đạo đức nghề nghiệp; thể hiện (có) tính trung thực, chịu trách nhiệm cá nhân, tinh thần tự học, tự nghiên cứu, hỗ trợ đồng nghiệp",Không biết
Chương trình đào tạo ngành Công nghệ Nông nghiệp yêu cầu bao nhiêu tín chỉ?,151 tín chỉ,"Chương trình đào tạo ngành Công nghệ Nông nghiệp yêu cầu tổng cộng 151 tín chỉ, bao gồm:"
Khối kiến thức chung của chương trình đào tạo ngành Công nghệ Nông nghiệp gồm bao nhiêu tín chỉ?,16 tín chỉ,21 tín chỉ
Học phần Triết học Mác - Lênin thuộc khối kiến thức nào trong chương trình đào tạo ngành Công nghệ Nông nghiệp?,Khối kiến thức chung,Không biết
Học phần Kinh tế chính trị Mác - Lênin có mã học phần tiên quyết là gì?,PHI1006,PHI1006
Học phần Nhập môn Công nghệ Nông nghiệp thuộc khối kiến thức nào?,Khối kiến thức theo khối ngành,Học phần Nhập môn Công nghệ Nông nghiệp (AGT2000) thuộc khối kiến thức theo khối ngành. 
Khối kiến thức theo nhóm ngành của chương trình đào tạo ngành Công nghệ Nông nghiệp có bao nhiêu tín chỉ bắt buộc?,24 tín chỉ,19
Học phần Kỹ thuật điện và điện tử thuộc khối kiến thức nào trong chương trình đào tạo ngành Công nghệ Nông nghiệp?,Khối kiến thức theo nhóm ngành,Không biết
Học phần Kỹ thuật điều khiển có mã học phần tiên quyết là gì?,ELT2035,Không biết
Học phần Cơ sở dữ liệu có mã học phần tiên quyết là gì?,INT1008,Không biết
Khối kiến thức ngành của chương trình đào tạo ngành Công nghệ Nông nghiệp có tổng cộng bao nhiêu tín chỉ?,68 tín chỉ,16 tín
Học phần Hệ sinh thái nông nghiệp và nông nghiệp bền vững thuộc khối kiến thức nào?,Khối kiến thức ngành,Không biết
Học phần Lập trình hướng đối tượng thuộc định hướng chuyên sâu nào?,Nông nghiệp kỹ thuật số,|  | Row 57: 45. | INT2204 | Lập trình hướng đối tượngObject-Oriented Programming | 3 | 30 | 15 |  | INT1008
Học phần Công nghệ sinh học phân tử thuộc định hướng chuyên sâu nào?,Công nghệ sinh học Nông nghiệp,AGT3120 | Công nghệ sinh học phân tửMolecular Biology Technology | 4 | 45 | 15 |  | AGT2103AGT2111 Row 56: 4
Học phần Thực tập Công nghệ Nông nghiệp có bao nhiêu tín chỉ?,3 tín chỉ,Không biết
Học phần Đồ án tốt nghiệp có bao nhiêu giờ tự học?,150 giờ,Tôi không biết
Tên tiếng Việt của ngành Hệ thống thông tin (CLC TT23) tại Trường Đại học Công nghệ là gì?,Hệ thống thông tin,Information Systems
Tên tiếng Anh của ngành Hệ thống thông tin (CLC TT23) tại Trường Đại học Công nghệ là gì?,Information Systems,4 năm
Mã số đào tạo của ngành Hệ thống thông tin (CLC TT23) tại Trường Đại học Công nghệ là gì?,7480104,7480104
Danh hiệu tốt nghiệp của sinh viên ngành Hệ thống thông tin (CLC TT23) tại Trường Đại học Công nghệ là gì?,Cử nhân,Cử nhân Hệ thống thông tin (Chương trình đào tạo chất lượng cao) 
Thời gian đào tạo ngành Hệ thống thông tin (CLC TT23) tại Trường Đại học Công nghệ là bao lâu?,4 năm,Thời gian đào tạo ngành Hệ thống thông tin (CLC TT23) tại Trường Đại học Công nghệ là 4 năm. 
Sinh viên tốt nghiệp ngành Hệ thống thông tin (CLC TT23) tại Trường Đại học Công nghệ nhận văn bằng gì?,Cử nhân Hệ thống thông tin,Cử nhân Hệ thống thông tin (Chương trình đào tạo chất lượng cao) 
Chương trình Hệ thống thông tin (CLC TT23) tại Trường Đại học Công nghệ thuộc hệ đào tạo nào?,Chất lượng cao,Chương trình Hệ thống thông tin (CLC TT23) tại Trường Đại học Công nghệ thuộc hệ đào tạo chất lượng cao. 
Mục tiêu của chương trình Hệ thống thông tin (CLC TT23) tại Trường Đại học Công nghệ là gì?,Đào tạo nhân lực chất lượng cao và bồi dưỡng nhân tài trình độ đại học ngành HTTT trong thời đại số hóa.,Mục tiêu của chương trình Hệ thống thông tin (CLC TT23) tại Trường Đại học Công nghệ là đào tạo toàn diện cả về chuyên môn lẫn phẩm chất nhân lực chất lượng cao và bồi dưỡng nhân tài trình độ đại
Chương trình Hệ thống thông tin (CLC TT23) tại Trường Đại học Công nghệ định hình theo mấy hướng chuyên sâu?,Hai,Chương trình Hệ thống thông tin (CLC TT23) tại Trường Đại học Công nghệ định hình theo 3 hướng chuyên sâu:
Hai hướng chuyên sâu của chương trình Hệ thống thông tin (CLC TT23) tại Trường Đại học Công nghệ là gì?,Tích hợp dịch vụ và quản lý dữ liệu lớn và Khoa học dữ liệu và phân tích kinh doanh,Tôi không biết
Hình thức tuyển sinh của Trường Đại học Công nghệ đối với ngành Hệ thống thông tin (CLC TT23) như thế nào?,Theo quy định của Đại học Quốc gia Hà Nội.,"Hình thức tuyển sinh: Theo quy định của Đại học Quốc gia Hà Nội. Dự kiến quy mô tuyển sinh: Theo phân bố chỉ tiêu hàng năm của Đại học Quốc gia Hà Nội và Trường Đại học Công nghệ, dự kiến tuyển 6"
Dự kiến quy mô tuyển sinh hàng năm của ngành Hệ thống thông tin (CLC TT23) tại Trường Đại học Công nghệ là bao nhiêu?,60 sinh viên/năm.,Không biết
Chương trình Hệ thống thông tin (CLC TT23) tại Trường Đại học Công nghệ trang bị kỹ năng giao tiếp tiếng Anh ở bậc nào?,Bậc 4/6 theo khung năng lực ngoại ngữ 6 bậc dùng cho Việt Nam.,Tôi không biết
Sinh viên tốt nghiệp ngành Hệ thống thông tin (CLC TT23) tại Trường Đại học Công nghệ cần có phẩm chất đạo đức như thế nào?,"Tinh thần trách nhiệm với bản thân, gia đình, tổ chức và xã hội, về tinh thần phụng sự đất nước Việt Nam phát triển phồn vinh và hạnh phúc.",- Trung thực;
Trường Đại học Công nghệ thuộc đại học quốc gia nào?,Trường Đại học Công nghệ thuộc Đại học Quốc gia Hà Nội.,Trường Đại học Công nghệ thuộc Đại học Quốc gia Hà Nội (ĐHQGHN). 
Sinh viên tốt nghiệp ngành Công nghệ Kỹ thuật Điện tử - Viễn thông cần có kiến thức cơ bản về lĩnh vực nào?,"Sinh viên tốt nghiệp ngành Công nghệ Kỹ thuật Điện tử - Viễn thông cần có kiến thức cơ bản về khoa học xã hội, khoa học chính trị và pháp luật.","Sinh viên tốt nghiệp ngành Công nghệ Kỹ thuật Điện tử - Viễn thông cần có kiến thức cơ bản về các nguyên lý cơ bản, các quy luật tự nhiên và xã hội trong lĩnh vực được đào tạo để phát triển kiến thức mới"
Sinh viên tốt nghiệp ngành Công nghệ Kỹ thuật Điện tử - Viễn thông có thể vận dụng kiến thức về lĩnh vực nào để giải quyết bài toán kỹ thuật?,Sinh viên tốt nghiệp ngành Công nghệ Kỹ thuật Điện tử - Viễn thông có thể vận dụng kiến thức về khoa học cơ bản và CNTT để giải quyết bài toán kỹ thuật.,Tôi không biết
Sinh viên tốt nghiệp ngành Công nghệ Kỹ thuật Điện tử - Viễn thông có thể sử dụng kiến thức chuyên sâu về lĩnh vực nào để thiết kế hệ thống?,Sinh viên tốt nghiệp ngành Công nghệ Kỹ thuật Điện tử - Viễn thông có thể sử dụng kiến thức chuyên sâu về điện tử và viễn thông để thiết kế hệ thống.,"Sinh viên tốt nghiệp ngành Công nghệ Kỹ thuật Điện tử - Viễn thông có thể sử dụng kiến thức chuyên sâu về Hệ thống cơ điện tử để thiết kế hệ thống. Cụ thể, sinh viên biết và sử dụng thành thạo"
Sinh viên tốt nghiệp ngành Công nghệ Kỹ thuật Điện tử - Viễn thông cần có kỹ năng gì để phát hiện và mô tả vấn đề?,Sinh viên tốt nghiệp ngành Công nghệ Kỹ thuật Điện tử - Viễn thông cần có kỹ năng áp dụng kiến thức khoa học và CNTT để phát hiện và mô tả vấn đề.,"Sinh viên tốt nghiệp ngành Công nghệ Kỹ thuật Điện tử - Viễn thông cần có kỹ năng phát hiện, mô tả, phản biện vấn đề và đề xuất giải pháp về lĩnh vực chuyên môn bằng cách áp dụng các kiến thức khoa"
Sinh viên tốt nghiệp ngành Công nghệ Kỹ thuật Điện tử - Viễn thông cần có kỹ năng gì trong việc giao tiếp?,Sinh viên tốt nghiệp ngành Công nghệ Kỹ thuật Điện tử - Viễn thông cần có kỹ năng giao tiếp hiệu quả với nhiều đối tượng.,"Sinh viên tốt nghiệp ngành Công nghệ Kỹ thuật Điện tử - Viễn thông cần có kỹ năng giao tiếp tốt. Cụ thể, theo PO3 (Phương thức đánh giá 3) trong ngữ cảnh, sinh viên cần"
