question,answer,generate_answer
Tổng số tín chỉ của chương trình đào tạo ngành Kỹ thuật Máy tính của Trường Đại học Công nghệ là bao nhiêu?,155 tín chỉ.,150 tín chỉ
Sinh viên ngành Kỹ thuật Máy tính của Trường Đại học Công nghệ phải học bao nhiêu tín chỉ khối kiến thức chung?,"29 tín chỉ (chưa tính GDTC, GDQP-AN và kỹ năng bổ trợ).",34
Sinh viên ngành Kỹ thuật Máy tính của Trường Đại học Công nghệ phải học bao nhiêu tín chỉ khối kiến thức theo lĩnh vực?,16 tín chỉ.,22
Sinh viên ngành Kỹ thuật Máy tính của Trường Đại học Công nghệ phải học bao nhiêu tín chỉ khối kiến thức theo khối ngành?,9 tín chỉ.,2
Sinh viên ngành Kỹ thuật Máy tính của Trường Đại học Công nghệ phải học bao nhiêu tín chỉ khối kiến thức theo nhóm ngành?,38 tín chỉ.,1
Sinh viên ngành Kỹ thuật Máy tính của Trường Đại học Công nghệ phải học bao nhiêu tín chỉ khối kiến thức ngành?,63 tín chỉ.,22 tín
Đồ án tốt nghiệp ngành Kỹ thuật Máy tính của Trường Đại học Công nghệ có bao nhiêu tín chỉ?,10 tín chỉ.,4
"Học phần ""Những nguyên lý cơ bản của chủ nghĩa Mác – Lênin 1"" có mã số học phần là gì tại Trường Đại học Công nghệ?",PHI1004.,Không biết
"Học phần ""Đường lối cách mạng của Đảng Cộng sản Việt Nam"" có bao nhiêu tín chỉ tại Trường Đại học Công nghệ?",3 tín chỉ.,Không biết
"Học phần tiên quyết của học phần ""Những nguyên lý cơ bản của chủ nghĩa Mác – Lênin 2"" là gì tại Trường Đại học Công nghệ?",PHI1004.,Không biết
"Học phần ""Tư tưởng Hồ Chí Minh"" có mã học phần là gì tại Trường Đại học Công nghệ?",POL1001.,Không biết
"Học phần ""Cấu trúc dữ liệu và giải thuật"" có mã số học phần là gì tại Trường Đại học Công nghệ?",INT2203.,INT2210
"Học phần tiên quyết của học phần ""Cấu trúc dữ liệu và giải thuật"" là gì tại Trường Đại học Công nghệ?",INT1006.,Không biết
"Học phần ""Kiến trúc máy tính"" có mã số học phần là gì tại Trường Đại học Công nghệ?",ELT3047.,Không biết
"Học phần ""Hệ thống vi xử lý"" có mã số học phần là gì tại Trường Đại học Công nghệ?",ELT3048.,Không biết
Tên đầy đủ của trường đào tạo ngành Công nghệ Thông tin định hướng thị trường Nhật Bản được nhắc đến là gì?,"Trường Đại học Công nghệ, ĐHQGHN.","Trường Đại học Công nghệ, ĐHQGHN - Univeristy of Engineering and Technology"
Sinh viên tốt nghiệp ngành Công nghệ Thông tin định hướng thị trường Nhật Bản cần có trình độ tiếng Nhật tương đương bậc nào?,N3.,Không biết
Sinh viên tốt nghiệp ngành Công nghệ Thông tin định hướng thị trường Nhật Bản có thể đảm nhiệm vị trí công tác nào?,Kỹ sư cầu nối Nhật Bản.,Sinh viên tốt nghiệp ngành Công nghệ Thông tin định hướng thị trường Nhật Bản có thể đảm nhiệm các vị trí sau:
Ngành Công nghệ Thông tin định hướng thị trường Nhật Bản trang bị cho sinh viên những kiến thức nền tảng nào trong lĩnh vực máy tính?,"Hệ thống máy tính, giải thuật và lập trình, cơ sở dữ liệu, phân tích thiết kế và phát triển phần mềm, mạng máy tính.",Không biết
Chuẩn đầu ra nào yêu cầu sinh viên ngành Công nghệ Thông tin định hướng thị trường Nhật Bản có khả năng làm việc độc lập và cập nhật công nghệ mới?,PLO2.6.,"PLO1.1. Diễn giải được kiến thức cơ bản về khoa học xã hội, về khoa học chính trị và pháp luật; về văn hóa, xã hội và nhân văn; về rèn luyện thể chất và quốc phòng;"
Chuẩn đầu ra nào yêu cầu sinh viên ngành Công nghệ Thông tin định hướng thị trường Nhật Bản có khả năng vận dụng kiến thức cơ bản về tiếng Nhật?,PLO2.8.,"PLO1.1. Diễn giải được kiến thức cơ bản về khoa học xã hội, về khoa học chính trị và pháp luật; về văn hóa, xã hội và nhân văn; về rèn luyện thể chất và quốc phòng;"
Sinh viên tốt nghiệp ngành Công nghệ Thông tin định hướng thị trường Nhật Bản có thể học lên các chương trình đào tạo nào?,Các chương trình đào tạo sau đại học.,Sinh viên tốt nghiệp ngành Công nghệ Thông tin định hướng thị trường Nhật Bản có thể học lên các chương trình đào tạo sau:
Sinh viên tốt nghiệp ngành Công nghệ Thông tin định hướng thị trường Nhật Bản cần chủ động tuân thủ điều gì?,"Pháp luật, đạo đức nghề nghiệp.",Không có thông tin trong ngữ cảnh về việc sinh viên tốt nghiệp ngành Công nghệ Thông tin định hướng thị trường Nhật Bản cần chủ động tuân thủ điều gì. 
Sinh viên tốt nghiệp ngành Công nghệ Thông tin định hướng thị trường Nhật Bản có thể làm việc cho loại hình doanh nghiệp nào?,Các doanh nghiệp Nhật Bản.,Sinh viên tốt nghiệp ngành Công nghệ Thông tin định hướng thị trường Nhật Bản có thể làm việc cho các doanh nghiệp Nhật Bản. 
Sinh viên ngành Công nghệ Thông tin định hướng thị trường Nhật Bản cần có kỹ năng nào để giải quyết vấn đề thực tế hiệu quả?,"Tư duy logic, biện chứng.","Sinh viên ngành Công nghệ Thông tin định hướng thị trường Nhật Bản cần có kỹ năng giải quyết vấn đề thực tế hiệu quả, bao gồm:"
Sinh viên ngành Công nghệ Thông tin định hướng thị trường Nhật Bản cần có khả năng gì để làm việc nhóm hiệu quả?,"Lập kế hoạch, điều phối, tổ chức, dẫn dắt và đánh giá công việc nhóm.",Không có thông tin cụ thể về khả năng làm việc nhóm hiệu quả của sinh viên ngành Công nghệ Thông tin định hướng thị trường Nhật Bản trong ngữ cảnh được cung cấp. 
Những kỹ năng nào được trang bị cho sinh viên ngành Công nghệ Thông tin định hướng thị trường Nhật Bản để đáp ứng yêu cầu cao về nghiên cứu và ứng dụng công nghệ thông tin của xã hội?,Kỹ năng tham mưu tư vấn và khả năng thực hiện nhiệm vụ với tư cách như một kỹ sư.,"- Kỹ năng làm việc độc lập, tự học, tự nghiên cứu và nâng cao trình độ."
Sinh viên ngành Công nghệ Thông tin định hướng thị trường Nhật Bản cần có kiến thức cơ bản về lĩnh vực nào?,"Toán học, khoa học cơ bản và CNTT.","Sinh viên ngành Công nghệ Thông tin định hướng thị trường Nhật Bản cần có kiến thức cơ bản, quan trọng và hiện đại về công nghệ thông tin và truyền thông. "
"Ngoài kiến thức chuyên môn, sinh viên ngành Công nghệ Thông tin định hướng thị trường Nhật Bản cần có kiến thức về lĩnh vực nào khác?","Khoa học xã hội, khoa học chính trị và pháp luật, văn hóa, xã hội và nhân văn.",Tôi không biết
Mục tiêu của chương trình đào tạo ngành Công nghệ Thông tin định hướng thị trường Nhật Bản là gì?,Đào tạo kỹ sư CNTT đáp ứng yêu cầu cao về nghiên cứu và ứng dụng công nghệ thông tin của xã hội và sẵn sàng làm việc cho các doanh nghiệp Nhật Bản.,Mục tiêu của chương trình đào tạo ngành Công nghệ Thông tin định hướng thị trường Nhật Bản là:
Tên đầy đủ của trường được đề cập trong văn bản là gì?,"Trường Đại học Công nghệ, Đại học Quốc gia Hà Nội.",Không biết
Văn bằng tốt nghiệp ngành Công nghệ Kỹ thuật Cơ điện tử của Trường Đại học Công nghệ là gì?,Không được đề cập trong văn bản.,+ Tiếng Việt: Cử nhân ngành Công nghệ kỹ thuật cơ điện tử
"Chuẩn đầu ra về ngoại ngữ của sinh viên ngành Công nghệ Kỹ thuật Cơ điện tử, Trường Đại học Công nghệ là gì?",Trình độ tiếng Anh tương đương trình độ bậc 3 (theo Khung năng lực ngoại ngữ 6 bậc dùng cho Việt Nam).,"Chuẩn đầu ra về ngoại ngữ của sinh viên ngành Công nghệ Kỹ thuật Cơ điện tử, Trường Đại học Công nghệ là đạt chuẩn 4/6 theo khung tham chiếu của Việt Nam (tương đương B2)."
Sinh viên tốt nghiệp ngành Công nghệ Kỹ thuật Cơ điện tử của Trường Đại học Công nghệ có thể làm việc ở vị trí nào?,"Kỹ sư phụ trách công tác kỹ thuật, thiết kế, quản lý dự án.",- Không có thông tin cụ thể về vị trí việc làm của sinh viên tốt nghiệp ngành Công nghệ Kỹ thuật Cơ điện tử trong ngữ cảnh được cung cấp. 
Sinh viên tốt nghiệp ngành Công nghệ Kỹ thuật Cơ điện tử của Trường Đại học Công nghệ có thể làm việc tại những loại hình cơ sở nào?,"Các cơ sở nghiên cứu, doanh nghiệp, các tổ chức sản xuất, kinh doanh liên quan đến Công nghệ Kỹ thuật Cơ điện tử, Tự động hóa.",Không biết
"Sinh viên tốt nghiệp ngành Công nghệ Kỹ thuật Cơ điện tử của Trường Đại học Công nghệ có thể đảm nhận công việc gì trong nhóm chuyên viên phân tích, tư vấn và kinh doanh?",Phụ trách dịch vụ sau bán hàng; phát triển mẫu mã sản phẩm.,"Sinh viên tốt nghiệp ngành Công nghệ Kỹ thuật Cơ điện tử của Trường Đại học Công nghệ có thể đảm nhận các công việc sau trong nhóm chuyên viên phân tích, tư vấn và kinh doanh:"
Sinh viên tốt nghiệp ngành Công nghệ Kỹ thuật Cơ điện tử của Trường Đại học Công nghệ có thể đảm nhận công việc gì trong nhóm nghiên cứu viên và giảng viên?,"Tham gia nghiên cứu các vấn đề có liên quan đến công nghệ cơ điện tử; trợ lý giảng dạy, giảng viên dạy các học phần thuộc ngành đào tạo.",- Tham gia nghiên cứu các vấn đề có liên quan đến công nghệ cơ điện tử
"Sau khi tốt nghiệp ngành Công nghệ Kỹ thuật Cơ điện tử, sinh viên Trường Đại học Công nghệ có thể học lên bậc học nào?","Bậc sau đại học các chuyên ngành thuộc lĩnh vực Công nghệ Cơ điện tử, Tự động hóa, Cơ kỹ thuật.","- Tiếp tục học bậc sau đại học các chuyên ngành thuộc lĩnh vực Công nghệ Cơ điện tử, Tự động hóa, Cơ kỹ thuật"
Sinh viên tốt nghiệp ngành Công nghệ Kỹ thuật Cơ điện tử của Trường Đại học Công nghệ cần có kỹ năng gì để làm việc nhóm hiệu quả?,"Kỹ năng lập kế hoạch, điều phối, quản lý nhóm làm việc hiệu quả với tư duy logic, biện chứng.",Không biết
Sinh viên ngành Công nghệ Kỹ thuật Cơ điện tử của Trường Đại học Công nghệ cần rèn luyện những phẩm chất đạo đức nào?,"Chủ động tuân thủ pháp luật, đạo đức nghề nghiệp; Thể hiện tính trung thực, chịu trách nhiệm cá nhân, tinh thần tự học, tự nghiên cứu, hỗ trợ đồng nghiệp.",- Trung thực
"Để giải quyết các vấn đề thực tế, sinh viên ngành Công nghệ Kỹ thuật Cơ điện tử của Trường Đại học Công nghệ cần có kỹ năng gì?",Kỹ năng giải quyết vấn đề thực tế hiệu quả và sáng tạo.,- Có khả năng phát hiện vấn đề và mối tương quan giữa các vấn đề trong lĩnh vực công nghệ cơ điện tử;
Sinh viên tốt nghiệp ngành Công nghệ Kỹ thuật Cơ điện tử của Trường Đại học Công nghệ có thể làm việc độc lập trong điều kiện nào?,Trong điều kiện làm việc thay đổi hoặc môi trường có áp lực cao.,Không biết
"Sau khi tốt nghiệp, sinh viên ngành Công nghệ Kỹ thuật Cơ điện tử của Trường Đại học Công nghệ có trách nhiệm gì với nhóm làm việc?",Chịu trách nhiệm đối với nhóm.,Không biết
Kiến thức nào giúp sinh viên ngành Công nghệ Kỹ thuật Cơ điện tử của Trường Đại học Công nghệ nhận định và phân tích các bài toán liên quan đến lĩnh vực kỹ thuật cơ điện tử?,Các kiến thức cơ bản của ngành.,PLO3: Sử dụng (3) các kiến thức cơ bản của ngành để nhận định (2) và phân tích (4) các bài toán liên quan đến lĩnh vực kỹ thuật cơ điện tử. 
Sinh viên ngành Công nghệ Kỹ thuật Cơ điện tử của Trường Đại học Công nghệ cần sử dụng kiến thức nào để cải thiện hiệu năng của các hệ thống cơ điện tử?,Các kiến thức chuyên sâu.,"Để cải thiện hiệu năng của các hệ thống cơ điện tử, sinh viên ngành Công nghệ Kỹ thuật Cơ điện tử của Trường Đại học Công nghệ cần sử dụng kiến thức sau:"
Trường Đại học Công nghệ thuộc trường đại học nào?,Đại học Quốc gia Hà Nội.,Trường Đại học Công nghệ thuộc Đại học Quốc gia Hà Nội (ĐHQGHN).
Website chính thức của Trường Đại học Công nghệ là gì?,https://uet.vnu.edu.vn,"URL: https://uet.vnu.edu.vn/dao-tao-dai-hoc/ Title: Đào tạo đại học - Trường Đại học Công nghệ, ĐHQGHN - Univeristy of Engineering and Technology"
Sinh viên Trường Đại học Công nghệ cần kiểm tra thông tin về điều kiện tốt nghiệp ở đâu?,https://bit.ly/4k4J3ld,A: Sinh viên Trường Đại học Công nghệ cần kiểm tra thông tin về điều kiện tốt nghiệp tại Phòng Đào tạo (ĐT) của trường. 
Phòng Đào tạo của Trường Đại học Công nghệ hỗ trợ sinh viên qua email nào?,dungnn09@vnu.edu.vn,Không biết
Số điện thoại liên hệ của Phòng Đào tạo Trường Đại học Công nghệ là bao nhiêu?,0243.202.6858,Không biết
Sinh viên Trường Đại học Công nghệ cần liên hệ ai tại Phòng Đào tạo để được hỗ trợ?,Nguyễn Ngọc Dũng,Không biết
Mục đích của thông báo trên website Trường Đại học Công nghệ là gì?,Chuẩn bị cho công tác xét tốt nghiệp của sinh viên năm 2025.,"Thông báo này nhằm mục đích thông báo cho sinh viên về việc xử lý học vụ học kỳ II năm học 2024-2025 tại Trường Đại học Công nghệ. Cụ thể, thông báo nêu rõ danh sách"
Sinh viên Trường Đại học Công nghệ cần kiểm tra những gì để chuẩn bị cho tốt nghiệp?,"Kết quả học tập, điều kiện tốt nghiệp.","Sinh viên Trường Đại học Công nghệ cần kiểm tra kết quả học tập cá nhân, đối chiếu với Khung chương trình đào tạo đang học và tham khảo tư vấn của Giáo viên chủ nhiệm để có kế hoạch học tập phù hợp, đủ"
Sinh viên Trường Đại học Công nghệ cần tham khảo ý kiến của ai để có kế hoạch học tập phù hợp?,Giáo viên chủ nhiệm.,Không biết
Thông báo trên website Trường Đại học Công nghệ do phòng ban nào phát hành?,Phòng Đào tạo.,Không biết
Tổng số tín chỉ của chương trình đào tạo ngành Trí tuệ nhân tạo là bao nhiêu?,124 tín chỉ.,124 tín chỉ
Sinh viên ngành Trí tuệ nhân tạo cần học bao nhiêu tín chỉ khối kiến thức chung?,16 tín chỉ.,"- Đối với chương trình đào tạo ngành Trí tuệ nhân tạo tại Trường Đại học Công nghệ, ĐHQGHN (chương trình 6), sinh viên cần học 21 tín chỉ khối kiến thức chung (không tính"
Sinh viên ngành Trí tuệ nhân tạo cần học bao nhiêu tín chỉ khối kiến thức ngành?,44 tín chỉ.,12 tín chỉ
Sinh viên ngành Trí tuệ nhân tạo cần thực tập doanh nghiệp bao nhiêu tín chỉ?,3 tín chỉ.,Tôi không biết
Sinh viên ngành Trí tuệ nhân tạo cần làm khóa luận tốt nghiệp bao nhiêu tín chỉ?,7 tín chỉ.,150 tín chỉ
"Học phần ""Triết học Mác - Lênin"" có mã học phần là gì?",PHI1006.,PHI1006
"Học phần ""Kinh tế chính trị Mác - Lênin"" yêu cầu học phần tiên quyết nào?",PHI1006.,PHI1006
"Học phần ""Đại số"" có bao nhiêu tín chỉ?",4 tín chỉ.,Không biết
"Học phần ""Giải tích 2"" yêu cầu học phần tiên quyết nào?",MAT1041.,Không biết
"Học phần ""Cấu trúc dữ liệu và giải thuật"" yêu cầu học phần tiên quyết nào?",INT1008.,Không biết
"Học phần ""Nhập môn trí tuệ nhân tạo"" có mã học phần là gì?",AIT1001.,AIT1001
"Học phần ""Lập trình xử lí dữ liệu với Python"" yêu cầu học phần tiên quyết nào?",INT1008.,Không biết
"Học phần ""Học máy"" yêu cầu học phần tiên quyết nào?",MAT1101 và INT2210.,Không biết
"Học phần ""Thực tập doanh nghiệp"" có mã học phần là gì?",AIT4002.,Không biết
Sinh viên ngành Trí tuệ nhân tạo có thể chọn học phần bổ trợ thuộc ngành nào khác không?,"Có, sinh viên có thể chọn 5 tín chỉ thuộc các CTĐT khác của Trường Đại học Công nghệ hoặc của các đơn vị đào tạo khác trong ĐHQGHN.","Có, sinh viên ngành Trí tuệ nhân tạo có thể chọn học phần bổ trợ thuộc ngành Khoa học Máy tính. Cụ thể, sinh viên có thể lựa chọn học các học phần như INT3131 (Dự án"
Chương trình đào tạo được mô tả trong văn bản thuộc ngành nào của Trường Đại học Công nghệ?,Khoa học máy tính.,"Chương trình đào tạo được mô tả trong văn bản thuộc ngành Công nghệ thông tin của Trường Đại học Công nghệ, ĐHQGHN - Univeristy of Engineering and Technology. "
Chương trình đào tạo ngành Khoa học máy tính thuộc hệ đào tạo nào của Trường Đại học Công nghệ?,CLC TT23 (Chất lượng cao theo Thông tư 23).,Chương trình đào tạo ngành Khoa học máy tính thuộc hệ đào tạo chuẩn quốc tế của Trường Đại học Công nghệ. 
Sinh viên tốt nghiệp ngành Khoa học Máy tính (CLC TT23) của Trường Đại học Công nghệ có thể học lên bậc học nào?,"Thạc sĩ, Tiến sĩ.",Không biết
Sinh viên tốt nghiệp ngành Khoa học Máy tính của Trường Đại học Công nghệ có đủ năng lực học lên cao học ở đâu không?,"Có, tại các trường đại học tiên tiến trên thế giới.",Tôi không biết
Kiến thức ngoại ngữ mà sinh viên ngành Khoa học Máy tính của Trường Đại học Công nghệ cần đạt được là bậc mấy?,Bậc 4/6 theo Khung năng lực ngoại ngữ 6 bậc dùng cho Việt Nam.,Không biết
Sinh viên tốt nghiệp ngành Khoa học Máy tính của Trường Đại học Công nghệ có thể đảm nhiệm vị trí công tác nào liên quan đến dữ liệu?,Chuyên viên phân tích dữ liệu bằng máy tính.,"- Chuyên viên phân tích, thiết kế, phát triển hệ thống"
Sinh viên tốt nghiệp ngành Khoa học Máy tính của Trường Đại học Công nghệ có thể đảm nhiệm vị trí công tác nào liên quan đến phần mềm?,Chuyên viên kiểm thử phần mềm.,- Lập trình viên hệ thống và cơ sở dữ liệu
Sinh viên tốt nghiệp ngành Khoa học Máy tính của Trường Đại học Công nghệ có thể đảm nhiệm vị trí công tác nào liên quan đến các hệ thống mạng?,Chuyên viên thiết kế và triển khai các hệ thống mạng và các dịch vụ mạng.,- Quản trị mạng
Sinh viên ngành Khoa học Máy tính của Trường Đại học Công nghệ có được trang bị kiến thức về trí tuệ nhân tạo không?,Có.,Có
Sinh viên ngành Khoa học Máy tính của Trường Đại học Công nghệ có được trang bị kiến thức về học máy không?,Có.,"Có, sinh viên ngành Khoa học Máy tính của Trường Đại học Công nghệ được trang bị kiến thức về học máy. Theo ngữ cảnh cung cấp, sinh viên được học về ""học máy"" là một trong những kiến thức cơ"
Sinh viên ngành Khoa học Máy tính của Trường Đại học Công nghệ có được trang bị kiến thức về xử lý ngôn ngữ tự nhiên không?,Có.,Có
Sinh viên ngành Khoa học Máy tính của Trường Đại học Công nghệ có được trang bị kiến thức về truyền thông đa phương tiện không?,Có.,"Có, sinh viên ngành Khoa học Máy tính của Trường Đại học Công nghệ được trang bị kiến thức về truyền thông đa phương tiện. Cụ thể, theo ngữ cảnh cung cấp, sinh viên được yêu cầu ""sâu vào"
Sinh viên ngành Khoa học Máy tính của Trường Đại học Công nghệ có được trang bị kiến thức về đồ họa máy tính không?,Có.,Không biết
Sinh viên ngành Khoa học Máy tính của Trường Đại học Công nghệ có được trang bị kiến thức về cơ sở dữ liệu không?,Có.,"Có, sinh viên ngành Khoa học Máy tính của Trường Đại học Công nghệ được trang bị kiến thức cơ bản về cơ sở dữ liệu. Cụ thể, theo ngữ cảnh cung cấp, sinh viên được trang bị kiến thức"
Trường Đại học Công nghệ trang bị cho sinh viên Khoa học Máy tính những phẩm chất đạo đức nào?,"Đạo đức cá nhân, đạo đức nghề nghiệp và đạo đức xã hội.",Trường Đại học Công nghệ trang bị cho sinh viên Khoa học Máy tính những phẩm chất đạo đức sau:
Trường Đại học Công nghệ có thông báo tuyển sinh đi học tại nước nào năm 2025?,Bun-ga-ri,Trường Đại học Công nghệ có thông báo tuyển sinh đi học tại Bun-ga-ri năm 2025. Thông tin chi tiết về chương trình được gửi trong văn bản đính kèm công văn số 126/TB-B
Thông báo tuyển sinh đi học tại Bun-ga-ri năm 2025 của Trường Đại học Công nghệ dựa trên công văn số mấy của Bộ Giáo dục và Đào tạo?,126/TB-BGĐT,A: 126/TB-BGĐT
Thời gian nộp hồ sơ (bản giấy và trực tuyến) cho chương trình tuyển sinh đi học tại Bun-ga-ri năm 2025 của Trường Đại học Công nghệ là trước ngày nào?,15/03/2025,Không biết
"Ngoài thông báo của Trường Đại học Công nghệ, người học có thể xem thông tin về học bổng tại trang web nào?",moet.gov.vn hoặc icd.edu.vn,Không biết
Tên tiếng Việt của ngành đào tạo CLC TT23 là gì?,Khoa học Máy tính,Mechatronics Engineering
Tên tiếng Anh của ngành đào tạo CLC TT23 là gì?,Computer Science,Mechatronics Engineering
Mã số đào tạo của ngành Khoa học Máy tính CLC TT23 là bao nhiêu?,52480101,4
Văn bằng tốt nghiệp của sinh viên ngành Khoa học Máy tính CLC TT23 là gì?,Cử nhân,Cử nhân Khoa học Máy tính (Chương trình đào tạo chất lượng cao) 
Thời gian đào tạo ngành Khoa học Máy tính CLC TT23 là bao lâu?,4 năm,Thời gian đào tạo ngành Khoa học Máy tính CLC TT23 là 4 năm. 
Sinh viên tốt nghiệp ngành Khoa học Máy tính CLC TT23 được trang bị những kiến thức gì?,"Kiến thức có hệ thống và hiện đại, phù hợp với các chương trình đào tạo tiên tiến trên thế giới.",Sinh viên tốt nghiệp ngành Khoa học Máy tính CLC TT23 được trang bị những kiến thức sau:
Chương trình Khoa học Máy tính CLC TT23 tập trung theo hướng nào?,Hướng công nghệ,Chương trình Khoa học Máy tính CLC TT23 tập trung theo ba hướng sau:
Doanh nghiệp CNTT có tham gia vào quá trình đào tạo chương trình Khoa học Máy tính CLC TT23 không?,Có,Không biết
Sinh viên Khoa học Máy tính CLC TT23 được đào tạo chuyên sâu theo những định hướng nào?,"“Phát triển hệ thống”, “Thương mại điện tử”, “Mạng máy tính”, “Các hệ thống thông minh” và “Tương tác người máy”.",Tôi không biết
Hình thức tuyển sinh của chương trình Khoa học Máy tính CLC TT23 được quy định bởi ai?,Đại học Quốc gia Hà Nội,Không biết
Quy mô tuyển sinh dự kiến của chương trình Khoa học Máy tính CLC TT23 được quy định bởi ai?,Đại học Quốc gia Hà Nội,Không biết
