question,answer,generate_answer
Thông tin tuyển sinh của Trường Đại học Công nghệ dựa trên những quy định nào?,"Quy chế, Quy định về công tác tuyển sinh đại học hằng năm của Bộ Giáo dục và Đào tạo; hướng dẫn của Đại học Quốc gia Hà Nội và Đề án tuyển sinh hằng năm của Trường Đại học Công nghệ.",Thông tin tuyển sinh của Trường Đại học Công nghệ dựa trên những quy định sau:
Ngành Công nghệ kỹ thuật cơ điện tử tại Trường Đại học Công nghệ yêu cầu bao nhiêu tín chỉ để hoàn thành chương trình đào tạo?,149 tín chỉ.,"149 tín chỉ (không tính các học phần Giáo dục thể chất, Giáo dục quốc phòng - an ninh và Kỹ năng bổ trợ) hoặc 134 tín chỉ (không tính các học phần Giáo dục thể"
Sinh viên ngành Công nghệ kỹ thuật cơ điện tử tại Trường Đại học Công nghệ có phải học Giáo dục thể chất không?,Có.,Không biết
Học phần Triết học Mác – Lênin tại Trường Đại học Công nghệ thuộc khối kiến thức nào?,Khối kiến thức chung.,I.    Khối kiến thức chung
Học phần Kinh tế chính trị Mác – Lênin tại Trường Đại học Công nghệ có học phần tiên quyết là gì?,Triết học Mác - Lênin.,PHI1006
Học phần Đại số tại Trường Đại học Công nghệ thuộc khối kiến thức nào?,Khối kiến thức theo lĩnh vực.,Không biết
Học phần Xác suất thống kê ứng dụng tại Trường Đại học Công nghệ có những học phần tiên quyết nào?,Đại số và Giải tích 2.,Không biết
Học phần Cơ học kỹ thuật 1 tại Trường Đại học Công nghệ thuộc khối kiến thức nào?,Khối kiến thức theo nhóm ngành.,Không biết
Học phần Sức bền vật liệu và cơ học kết cấu tại Trường Đại học Công nghệ có học phần tiên quyết là gì?,Cơ học kỹ thuật 2.,Không biết
Học phần Kỹ năng khởi nghiệp tại Trường Đại học Công nghệ thuộc khối kiến thức nào?,Khối kiến thức bổ trợ.,"LLCT (13): Lý luận chính trị & Pháp luật đại cương GDTC, GDQP-AN (12): Giáo dục thể chất, Giáo dục Quốc phòng – An ninh KNBT (3): Kỹ năng bổ trợ"
Học phần Hệ thống cơ điện tử tại Trường Đại học Công nghệ thuộc khối kiến thức định hướng chuyên sâu nào?,Hệ thống cơ điện tử.,V.3.1.1 | Các học phần bắt buộc | 19 |  |  |  |
Học phần Công nghệ chế tạo máy tại Trường Đại học Công nghệ thuộc khối kiến thức định hướng chuyên sâu nào?,Chế tạo thiết bị.,Không biết
Học phần Điện tử công suất tại Trường Đại học Công nghệ thuộc khối kiến thức định hướng chuyên sâu nào?,Đo lường và điều khiển.,Không biết
Học phần Công nghệ vi chế tạo tại Trường Đại học Công nghệ thuộc khối kiến thức định hướng chuyên sâu nào?,Hệ thống vi cơ điện tử và nanô cơ điện tử.,Không biết
Học phần Mô phỏng và thiết kế robot tại Trường Đại học Công nghệ thuộc khối kiến thức định hướng chuyên sâu nào?,Kỹ thuật robot.,Không biết
Học phần Chẩn đoán kỹ thuật và kiểm tra không phá huỷ tại Trường Đại học Công nghệ thuộc khối kiến thức định hướng chuyên sâu nào?,Chẩn đoán kỹ thuật.,Không biết
Tên tiếng Việt của ngành đào tạo được giới thiệu là gì?,Công nghệ Hàng không Vũ trụ,Information Technology
Tên tiếng Anh của ngành đào tạo được giới thiệu là gì?,Aerospace Engineering,Không có thông tin trong ngữ cảnh về tên tiếng Anh của ngành đào tạo được giới thiệu. 
Danh hiệu tốt nghiệp của ngành Công nghệ Hàng không Vũ trụ là gì?,Kỹ sư,Danh hiệu tốt nghiệp của ngành Công nghệ Hàng không Vũ trụ là Kỹ sư. 
Thời gian đào tạo ngành Công nghệ Hàng không Vũ trụ là bao lâu?,"4,5 năm","Thời gian đào tạo ngành Công nghệ Hàng không Vũ trụ là 4,5 năm. "
Tên văn bằng tốt nghiệp tiếng Việt của ngành đào tạo là gì?,Kỹ sư ngành Công nghệ Hàng không Vũ trụ,Bachelor of Industrial and Graphic Design
Tên văn bằng tốt nghiệp tiếng Anh của ngành đào tạo là gì?,The Degree of Engineer in Aerospace Engineering.,4 năm
Sinh viên tốt nghiệp ngành Công nghệ Hàng không Vũ trụ có khả năng gì sau 3-5 năm?,Áp dụng kiến thức về hàng không vũ trụ để cung cấp các sản phẩm theo nhu cầu xã hội.,"- Có khả năng áp dụng kiến thức sâu rộng về các nguyên tắc cơ bản, các kỹ thuật hàng không vũ trụ để cung cấp các sản phẩm theo nhu cầu xã hội trong lĩnh vực hàng không vũ trụ và các lĩnh vực có liên"
Sinh viên tốt nghiệp ngành Công nghệ Hàng không Vũ trụ có thể phát triển gì?,Các công nghệ tiên tiến và đề xuất giải pháp cho vấn đề hàng không vũ trụ.,"Sinh viên tốt nghiệp ngành Công nghệ Hàng không Vũ trụ có khả năng tham mưu tư vấn và có năng lực thực hiện nhiệm vụ với tư cách như một kỹ sư trong lĩnh vực Hàng không Vũ trụ, đáp ứng các yêu cầu ca"
Sinh viên tốt nghiệp ngành Công nghệ Hàng không Vũ trụ có vai trò gì trong các nhóm làm việc đa ngành?,"Vai trò lãnh đạo, trung tâm.",Không biết
Sinh viên tốt nghiệp ngành Công nghệ Hàng không Vũ trụ có thể thiết kế và chế tạo các thiết bị gì?,"Thiết bị bay, vệ tinh.","Sinh viên tốt nghiệp ngành Công nghệ Hàng không Vũ trụ có thể thiết kế và chế tạo các thiết bị bay, vệ tinh. "
Hình thức tuyển sinh của Trường Đại học Công nghệ đối với ngành Công nghệ Hàng không Vũ trụ như thế nào?,Theo quy định tuyển sinh đại học của Đại học Quốc gia Hà Nội.,Không biết
Dự kiến quy mô tuyển sinh của ngành Công nghệ Hàng không Vũ trụ là bao nhiêu?,Khoảng 60-100 sinh viên/ khóa học.,Không biết
Ngành Công nghệ Hàng không Vũ trụ thuộc trường nào?,"Trường Đại học Công nghệ, ĐHQGHN","4,5 năm"
Sinh viên tốt nghiệp ngành Công nghệ Hàng không Vũ trụ có thể nghiên cứu kỹ thuật gì?,Kỹ thuật thăm dò không gian.,Sinh viên tốt nghiệp ngành Công nghệ Hàng không Vũ trụ có thể nghiên cứu các kỹ thuật sau:
Sinh viên tốt nghiệp ngành Công nghệ Hàng không Vũ trụ có kiến thức sâu rộng trong các lĩnh vực nào?,"Hàng không – Vũ trụ, Điện tử hàng không, Công nghệ thông tin, Khoa học vật liệu, Cơ học kỹ thuật và tự động hóa.",Sinh viên tốt nghiệp ngành Công nghệ Hàng không Vũ trụ có kiến thức sâu rộng trong các lĩnh vực sau:
Sinh viên tốt nghiệp ngành Vật lý kỹ thuật tại Trường Đại học Công nghệ cần tích lũy bao nhiêu tín chỉ?,131 tín chỉ.,Sinh viên tốt nghiệp ngành Vật lý kỹ thuật tại Trường Đại học Công nghệ cần tích lũy 134 tín chỉ.
"Chuẩn đầu ra về ngoại ngữ của sinh viên ngành Vật lý kỹ thuật, Trường Đại học Công nghệ tương đương bậc mấy theo Khung năng lực ngoại ngữ Việt Nam?",Bậc 3.,"Chuẩn đầu ra về ngoại ngữ của sinh viên ngành Vật lý kỹ thuật, Trường Đại học Công nghệ tương đương bậc 3 theo Khung năng lực ngoại ngữ Việt Nam. "
Sinh viên ngành Vật lý kỹ thuật của Trường Đại học Công nghệ được trang bị kiến thức về những lĩnh vực nào?,"Vật lý, hóa học, khoa học vật liệu, sinh học và công nghệ nano.",- Kiến thức vật lý: Biết được các kiến thức cơ bản về Vật lý đại cương; Hiểu được các hiện tượng và quy luật Vật lý và các ứng dụng liên quan trong khoa học kỹ thuật và đời
Sinh viên tốt nghiệp ngành Vật lý kỹ thuật tại Trường Đại học Công nghệ có thể đảm nhiệm vị trí nào?,"Cán bộ kỹ thuật, chuyên viên kiểm soát quy trình sản xuất, cán bộ nghiên cứu, giảng viên, nghiên cứu viên.",Không biết
Sinh viên tốt nghiệp ngành Vật lý kỹ thuật tại Trường Đại học Công nghệ có thể học lên bậc học nào?,"Thạc sĩ, tiến sĩ.","Cử nhân ngành Vật lý kỹ thuật có khả năng học tập và nghiên cứu tiếp ở các bậc học cao hơn (thạc sĩ, tiến sĩ) thuộc các lĩnh vực về vật liệu và linh kiện micro-nano, vật lý"
Sinh viên ngành Vật lý kỹ thuật tại Trường Đại học Công nghệ cần có kiến thức về kiến thức vật lý nào?,Vật lý đại cương.,"Sinh viên ngành Vật lý kỹ thuật tại Trường Đại học Công nghệ cần có kiến thức về các hiện tượng và quy luật Vật lý, bao gồm Vật lý cơ, nhiệt, điện và quang, và các ứng dụng của"
Sinh viên ngành Vật lý kỹ thuật tại Trường Đại học Công nghệ cần có kỹ năng nghề nghiệp nào?,Lập trình và sử dụng các công cụ phần mềm.,Không biết
Sinh viên ngành Vật lý kỹ thuật tại Trường Đại học Công nghệ cần có kỹ năng chuyên môn nào?,Kỹ năng hoàn thành công việc phức tạp.,Không biết
Sinh viên ngành Vật lý kỹ thuật tại Trường Đại học Công nghệ cần có phẩm chất đạo đức cá nhân nào?,"Trung thực, lễ độ, khiêm tốn, nhiệt tình.",- Lễ độ
Sinh viên ngành Vật lý kỹ thuật tại Trường Đại học Công nghệ cần có phẩm chất đạo đức nghề nghiệp nào?,"Có trách nhiệm với công việc, trung thành với tổ chức, nhiệt tình và say mê với công việc.",- Trung thực
Sinh viên ngành Vật lý kỹ thuật tại Trường Đại học Công nghệ cần có phẩm chất đạo đức xã hội nào?,"Có trách nhiệm với xã hội, tuân thủ luật pháp, có ý thức phục vụ, nhiệt tình tham gia các hoạt động xã hội.",Tôi không biết
Sinh viên ngành Vật lý kỹ thuật tại Trường Đại học Công nghệ có cần kỹ năng làm việc nhóm không?,Có.,"Có, sinh viên ngành Vật lý kỹ thuật tại Trường Đại học Công nghệ cần có kỹ năng làm việc nhóm. Điều này được thể hiện qua yêu cầu về kỹ năng làm việc độc lập hoặc theo nhóm trong tiêu chuẩn MT4 (M"
Sinh viên ngành Vật lý kỹ thuật tại Trường Đại học Công nghệ cần có kiến thức về kiến thức toán học nào?,Giải tích toán học và Đại số cao cấp.,Sinh viên ngành Vật lý kỹ thuật tại Trường Đại học Công nghệ cần có kiến thức về:
Sinh viên ngành Vật lý kỹ thuật tại Trường Đại học Công nghệ cần có kỹ năng giao tiếp nào?,Truyền đạt vấn đề và giải pháp tới người khác.,"PO3: Có kỹ năng giao tiếp, làm việc nhóm, phát hiện và giải quyết vấn đề, tư duy, phản biện, sáng tạo. "
Sinh viên ngành Vật lý kỹ thuật tại Trường Đại học Công nghệ cần có kỹ năng quản lý và lãnh đạo nào?,"Kỹ năng dẫn dắt, khởi nghiệp, tạo việc làm cho mình và cho người khác.",Sinh viên ngành Vật lý kỹ thuật tại Trường Đại học Công nghệ cần có kỹ năng quản lý và lãnh đạo bao gồm:
Tên tiếng Việt của ngành đào tạo là gì?,Công nghệ Hàng không Vũ trụ,Không biết
Tên tiếng Anh của ngành Công nghệ Hàng không Vũ trụ là gì?,Aerospace Engineering,"A: 4,5 năm"
Mã số ngành đào tạo Công nghệ Hàng không Vũ trụ là bao nhiêu?,7519001,"4,"
Ngành Công nghệ Hàng không Vũ trụ sử dụng ngôn ngữ đào tạo nào?,Tiếng Việt,Tiếng Việt
Danh hiệu tốt nghiệp của ngành Công nghệ Hàng không Vũ trụ là gì?,Kĩ sư,Danh hiệu tốt nghiệp của ngành Công nghệ Hàng không Vũ trụ là Kỹ sư. 
Thời gian đào tạo ngành Công nghệ Hàng không Vũ trụ là bao lâu?,"4,5 năm","Thời gian đào tạo ngành Công nghệ Hàng không Vũ trụ là 4,5 năm. "
Văn bằng tốt nghiệp ngành Công nghệ Hàng không Vũ trụ bằng tiếng Việt là gì?,Kỹ sư ngành Công nghệ Hàng không Vũ trụ,Văn bằng tốt nghiệp ngành Công nghệ Hàng không Vũ trụ bằng tiếng Anh là: The Degree of
Văn bằng tốt nghiệp ngành Công nghệ Hàng không Vũ trụ bằng tiếng Anh là gì?,The Degree of Engineer in Aerospace Engineering,Kỹ sư ngành Công nghệ Hàng không Vũ trụ
Kỹ sư ngành Công nghệ Hàng không Vũ trụ cần có kiến thức về những lĩnh vực công nghệ kỹ thuật nào?,"Cơ khí, Điện tử, Công nghệ thông tin và Điều khiển",Kỹ sư ngành Công nghệ Hàng không Vũ trụ cần có kiến thức về các lĩnh vực công nghệ kỹ thuật sau:
"Chương trình Công nghệ Hàng không Vũ trụ của Trường Đại học Công nghệ có đào tạo về thiết kế, chế tạo thiết bị bay không?",Có,Không biết
"Chương trình Công nghệ Hàng không Vũ trụ của Trường Đại học Công nghệ có đào tạo về khai thác, phát triển các công nghệ tiên tiến trong lĩnh vực Hàng không Vũ trụ không?",Có,"Có, chương trình đào tạo ngành Công nghệ Hàng không Vũ trụ của Trường Đại học Công nghệ nhằm mục tiêu đào tạo người học sau khi tốt nghiệp 3-5 năm có khả năng phát triển các công nghệ tiên tiến và đề xuất giải pháp"
"Sinh viên tốt nghiệp ngành Công nghệ Hàng không Vũ trụ có khả năng thiết kế, chế tạo thiết bị bay không?",Có,Có
"Sinh viên tốt nghiệp ngành Công nghệ Hàng không Vũ trụ có khả năng thiết kế, chế tạo vệ tinh không?",Có,Có
Trường Đại học Công nghệ tuyển sinh ngành Công nghệ Hàng không Vũ trụ dựa trên quy chế của đơn vị nào?,"Bộ Giáo dục và Đào tạo, Đại học Quốc gia Hà Nội và Đề án tuyển sinh của Trường Đại học Công nghệ.","Trường Đại học Công nghệ tuyển sinh ngành Công nghệ Hàng không Vũ trụ dựa trên Quy chế tạm thời về tổ chức và hoạt động của Trường Đại học Công nghệ, ban hành theo Nghị quyết số 985/NQ-HĐT"
Trường Đại học Công nghệ có đào tạo về nghiên cứu kỹ thuật thăm dò không gian không?,Có,Không biết
Trường Đại học Công nghệ thuộc đại học quốc gia nào?,Đại học Quốc gia Hà Nội,Trường Đại học Công nghệ thuộc Đại học Quốc gia Hà Nội (ĐHQGHN). 
Tên tiếng Anh của Trường Đại học Công nghệ là gì?,University of Engineering and Technology,4 năm
Ngành Truyền thông và Mạng máy tính của Trường Đại học Công nghệ yêu cầu bao nhiêu tín chỉ?,157 tín chỉ,157 tín chỉ
Sinh viên ngành Truyền thông và Mạng máy tính của Trường Đại học Công nghệ phải học bao nhiêu tín chỉ khối kiến thức chung?,"29 tín chỉ (chưa tính GDTC, GDQP-AN và Kĩ năng bổ trợ)",29 tín chỉ
Sinh viên ngành Truyền thông và Mạng máy tính của Trường Đại học Công nghệ phải học bao nhiêu tín chỉ khối kiến thức theo lĩnh vực?,18 tín chỉ,29
Sinh viên ngành Truyền thông và Mạng máy tính của Trường Đại học Công nghệ phải học bao nhiêu tín chỉ khối kiến thức theo khối ngành?,9 tín chỉ,29
Sinh viên ngành Truyền thông và Mạng máy tính của Trường Đại học Công nghệ phải học bao nhiêu tín chỉ khối kiến thức theo nhóm ngành?,19 tín chỉ,
Sinh viên ngành Truyền thông và Mạng máy tính của Trường Đại học Công nghệ phải học bao nhiêu tín chỉ khối kiến thức ngành?,82 tín chỉ,
Đồ án tốt nghiệp ngành Truyền thông và Mạng máy tính của Trường Đại học Công nghệ chiếm bao nhiêu tín chỉ?,10 tín chỉ,Không biết
"Học phần ""Những nguyên lý cơ bản của Chủ nghĩa Mác – Lênin 1"" của Trường Đại học Công nghệ có mã học phần là gì?",PHI1004,Không biết
"Học phần ""Tư tưởng Hồ Chí Minh"" của Trường Đại học Công nghệ có mã học phần là gì?",POL1001,Không biết
"Học phần ""Đường lối cách mạng của Đảng Cộng sản Việt Nam"" của Trường Đại học Công nghệ có mã học phần là gì?",HIS1002,Không biết
"Học phần ""Tin học cơ sở 4"" của Trường Đại học Công nghệ yêu cầu học phần tiên quyết nào?",INT1003,Không biết
"Học phần ""Giải tích 2"" của Trường Đại học Công nghệ yêu cầu học phần tiên quyết nào?",MAT1041,Không biết
"Học phần ""Xử lý tín hiệu số"" của Trường Đại học Công nghệ yêu cầu học phần tiên quyết nào?",MAT1093,Không biết
Tên tiếng Việt của ngành Công nghệ Thông tin đào tạo tại Trường Đại học Công nghệ là gì?,Công nghệ Thông tin,Information Technology
Tên tiếng Anh của ngành Công nghệ Thông tin đào tạo tại Trường Đại học Công nghệ là gì?,Information Technology,4 năm
Mã số ngành Công nghệ Thông tin đào tạo tại Trường Đại học Công nghệ là bao nhiêu?,7480201,4 năm
Danh hiệu tốt nghiệp ngành Công nghệ Thông tin tại Trường Đại học Công nghệ là gì?,Cử nhân,Danh hiệu tốt nghiệp ngành Công nghệ Thông tin tại Trường Đại học Công nghệ là Cử nhân ngành Công nghệ Thông tin (Chương trình đào tạo chất lượng cao) hoặc The Degree of Bachelor in Information Technology (Honors Program).
Thời gian đào tạo ngành Công nghệ Thông tin chất lượng cao tại Trường Đại học Công nghệ là bao lâu?,4 năm,Thời gian đào tạo ngành Công nghệ Thông tin chất lượng cao tại Trường Đại học Công nghệ là 4 năm. 
Văn bằng tốt nghiệp ngành Công nghệ Thông tin tại Trường Đại học Công nghệ được gọi là gì trong tiếng Việt?,Cử nhân ngành Công nghệ Thông tin (Chương trình đào tạo chất lượng cao),The Degree of Bachelor
Văn bằng tốt nghiệp ngành Công nghệ Thông tin tại Trường Đại học Công nghệ được gọi là gì trong tiếng Anh?,The Degree of Bachelor in Information Technology (Honors Program),A:
Chương trình Công nghệ Thông tin chất lượng cao của Trường Đại học Công nghệ hướng đến đào tạo nguồn nhân lực như thế nào?,"Cử nhân có trình độ chuyên môn cao về CNTT, có năng lực phát triển, triển khai và vận hành các hệ thống phần mềm và các giải pháp CNTT tiên tiến.","Chương trình Công nghệ Thông tin chất lượng cao của Trường Đại học Công nghệ hướng đến đào tạo nguồn nhân lực cử nhân có trình độ chuyên môn cao về Công nghệ Thông tin, có năng lực phát triển, triển khai và vận hành"
Chương trình Công nghệ Thông tin chất lượng cao tại Trường Đại học Công nghệ có bao nhiêu định hướng chuyên sâu?,4,Có 3 định hướng chuyên sâu trong lĩnh vực CNTT:
Định hướng Công nghệ phần mềm của chương trình Công nghệ Thông tin chất lượng cao tại Trường Đại học Công nghệ tập trung vào điều gì?,"Các phương pháp, công cụ và quy trình phát triển, quản lý và bảo trì hệ thống phần mềm.","Định hướng Công nghệ phần mềm của chương trình Công nghệ Thông tin chất lượng cao tại Trường Đại học Công nghệ tập trung vào các phương pháp, công cụ và quy trình phát triển, quản lý và bảo trì hệ thống phần mềm. Sin"
Định hướng Hệ thống thông tin của chương trình Công nghệ Thông tin chất lượng cao tại Trường Đại học Công nghệ trang bị kiến thức về vấn đề gì?,"Phát triển và vận hành các hệ thống thông tin cho việc quản lý kinh tế, hành chính và dịch vụ.","Định hướng Hệ thống thông tin của chương trình Công nghệ Thông tin chất lượng cao tại Trường Đại học Công nghệ trang bị kiến thức về phát triển và vận hành các hệ thống thông tin cho việc quản lý kinh tế, hành chính và"
Định hướng Mạng và truyền thông máy tính của chương trình Công nghệ Thông tin chất lượng cao tại Trường Đại học Công nghệ tập trung vào công nghệ nào?,Các công nghệ để phát triển và vận hành các hệ thống mạng và truyền thông máy tính.,Định hướng Mạng và truyền thông máy tính của chương trình Công nghệ Thông tin chất lượng cao tại Trường Đại học Công nghệ tập trung vào các công nghệ để phát triển và vận hành các hệ thống mạng và truyền thông máy tính.
Định hướng Khoa học máy tính của chương trình Công nghệ Thông tin chất lượng cao tại Trường Đại học Công nghệ tập trung vào vấn đề chuyên sâu nào?,"Học máy, xử lý ảnh và xử lý ngôn ngữ tự nhiên.",Tôi không biết
Trường Đại học Công nghệ áp dụng phương pháp dạy - học như thế nào trong chương trình Công nghệ Thông tin chất lượng cao?,Phương pháp dạy - học tiên tiến.,Không biết
Thông tin tuyển sinh vào Trường Đại học Công nghệ được thực hiện theo quy chế của đơn vị nào?,"Bộ Giáo dục và Đào tạo, Đại học Quốc gia Hà Nội và Đề án tuyển sinh hằng năm của Trường Đại học Công nghệ.",Trường Đại học Công nghệ thông tin tuyển sinh được thực hiện theo quy chế của Bộ Giáo dục và Đào tạo. 
Sinh viên tốt nghiệp ngành Kỹ thuật điều khiển và tự động hóa có thể làm việc ở viện nghiên cứu nào?,Viện Nghiên cứu Điện tử – Tin học – Tự động hóa.,- Viện Nghiên cứu Điện tử – Tin học – Tự động hóa
Sinh viên tốt nghiệp ngành Kỹ thuật điều khiển và tự động hóa có thể làm việc ở vị trí nào trong các trường đại học?,Giảng viên hoặc nghiên cứu viên.,Có thể làm việc
Sinh viên tốt nghiệp ngành Kỹ thuật điều khiển và tự động hóa có thể làm việc ở loại hình doanh nghiệp nào?,Các doanh nghiệp sản xuất trong nước và nước ngoài.,Sinh viên tốt nghiệp ngành Kỹ thuật điều khiển và tự động hóa có thể làm việc ở các loại hình doanh nghiệp sau:
Sinh viên tốt nghiệp ngành Kỹ thuật điều khiển và tự động hóa có thể làm việc ở vị trí nào trong các dây chuyền sản xuất hiện đại?,"Kỹ sư thiết kế, vận hành, bảo trì kỹ thuật.","Sinh viên tốt nghiệp ngành Kỹ thuật điều khiển và tự động hóa có thể làm việc ở vị trí Kỹ sư thiết kế, vận hành, bảo trì Kỹ thuật trong các dây chuyền sản xuất hiện đại trong công nghiệp như dây"
Sinh viên tốt nghiệp ngành Kỹ thuật điều khiển và tự động hóa có thể đảm nhiệm vị trí nào trong các doanh nghiệp tư vấn kỹ thuật?,Nhân viên hỗ trợ kỹ thuật hoặc giới thiệu sản phẩm.,"Sinh viên tốt nghiệp ngành Kỹ thuật điều khiển và tự động hóa có thể đảm nhiệm vị trí Chuyên viên phân tích, tư vấn tại các doanh nghiệp tư vấn kỹ thuật. "
Ngành Kỹ thuật điều khiển và tự động hóa trang bị cho sinh viên kỹ năng ngoại ngữ nào?,Tiếng Anh.,Không biết
Trình độ tiếng Anh mà sinh viên ngành Kỹ thuật điều khiển và tự động hóa cần đạt được là bậc mấy theo Khung năng lực ngoại ngữ 6 bậc dùng cho Việt Nam?,Bậc 3.,Trình độ tiếng Anh mà sinh viên ngành Kỹ thuật điều khiển và tự động hóa cần đạt được là bậc 3 theo Khung năng lực ngoại ngữ 6 bậc dùng cho Việt Nam. 
Sinh viên tốt nghiệp ngành Kỹ thuật điều khiển và tự động hóa có thể học lên bậc học nào?,"Thạc sĩ, tiến sĩ.","Sinh viên tốt nghiệp ngành Kỹ thuật điều khiển và tự động hóa có thể học lên bậc sau đại học các chuyên ngành thuộc lĩnh vực Robot, Điều khiển và Tự động hóa, Điện tử – Viễn thông, Cơ Điện tử,"
