question,answer,generate_answer
Học phần Phương pháp tính trong kỹ thuật yêu cầu học phần tiên quyết nào?,"INT1008, MAT1093, MAT1042",Không biết
Học phần Cơ học kỹ thuật 2 yêu cầu học phần tiên quyết nào?,EMA2036,Tôi không biết
Học phần Nhập môn điều khiển thông minh yêu cầu học phần tiên quyết nào?,"MAT1042, EMA2013",Không biết
"Học phần Lập trình nâng cao ứng dụng trong đo lường, điều khiển yêu cầu học phần tiên quyết nào?","INT1008, EMA2013",Không biết
Chương trình đào tạo ngành Công nghệ Vật liệu của Trường Đại học Công nghệ yêu cầu bao nhiêu tín chỉ?,"150 tín chỉ (chưa tính Giáo dục thể chất, Giáo dục quốc phòng – an ninh, kĩ năng bổ trợ).",134 tín
Khối kiến thức chung trong chương trình đào tạo ngành Công nghệ Vật liệu của Trường Đại học Công nghệ chiếm bao nhiêu tín chỉ?,21 tín chỉ.,
Khối kiến thức ngành trong chương trình đào tạo ngành Công nghệ Vật liệu của Trường Đại học Công nghệ chiếm bao nhiêu tín chỉ?,87 tín chỉ.,
Sinh viên ngành Công nghệ Vật liệu của Trường Đại học Công nghệ phải thực tập công nghiệp bao nhiêu tín chỉ?,6 tín chỉ.,87
Sinh viên ngành Công nghệ Vật liệu của Trường Đại học Công nghệ phải thực hiện đồ án tốt nghiệp bao nhiêu tín chỉ?,10 tín chỉ.,10 tín
Học phần Triết học Mác – Lênin thuộc khối kiến thức nào trong chương trình đào tạo ngành Công nghệ Vật liệu của Trường Đại học Công nghệ?,Khối kiến thức chung.,Không biết
Học phần Đại số thuộc khối kiến thức nào trong chương trình đào tạo ngành Công nghệ Vật liệu của Trường Đại học Công nghệ?,Khối kiến thức theo lĩnh vực.,Không biết
Học phần Cơ – Nhiệt thuộc khối kiến thức nào trong chương trình đào tạo ngành Công nghệ Vật liệu của Trường Đại học Công nghệ?,Khối kiến thức theo khối ngành.,Không biết
Học phần Vật lý lượng tử thuộc khối kiến thức nào trong chương trình đào tạo ngành Công nghệ Vật liệu của Trường Đại học Công nghệ?,Khối kiến thức theo nhóm ngành.,A: Vật lý lượng tử thuộc khối kiến thức theo nhóm ngành trong chương trình đào tạo ngành Công nghệ Vật liệu của Trường Đại học Công nghệ. 
Học phần Nhập môn công nghệ vật liệu và vi điện tử thuộc khối kiến thức nào trong chương trình đào tạo ngành Công nghệ Vật liệu của Trường Đại học Công nghệ?,Khối kiến thức ngành.,Không biết
Học phần Vật liệu ứng dụng trong vi điện tử là học phần bắt buộc hay tự chọn thuộc chuyên sâu Công nghệ vật liệu của Trường Đại học Công nghệ?,Bắt buộc.,"Học phần Vật liệu ứng dụng trong vi điện tử (EPN3075) là học phần bắt buộc thuộc chuyên sâu Công nghệ vật liệu của Trường Đại học Công nghệ. Điều này được xác nhận từ thông tin trong ngữ cảnh,"
Học phần Công nghệ chế tạo pin mặt trời là học phần bắt buộc hay tự chọn thuộc chuyên sâu Công nghệ vật liệu của Trường Đại học Công nghệ?,Tự chọn.,Học phần Công nghệ chế tạo pin mặt trời (EPN3055) là học phần tự chọn thuộc chuyên sâu Công nghệ vật liệu của Trường Đại học Công nghệ. 
Học phần Kỹ thuật CMOS là học phần bắt buộc hay tự chọn thuộc chuyên sâu Công nghệ vi điện tử của Trường Đại học Công nghệ?,Bắt buộc.,"Học phần Kỹ thuật CMOS (EPN3082) là học phần bắt buộc thuộc chuyên sâu Công nghệ vi điện tử của Trường Đại học Công nghệ. Điều này được xác nhận từ thông tin trong ngữ cảnh, cụ thể là"
Học phần Công nghệ vi cơ điện tử là học phần bắt buộc hay tự chọn thuộc chuyên sâu Công nghệ vi điện tử của Trường Đại học Công nghệ?,Tự chọn.,"Học phần Công nghệ vi cơ điện tử (EMA2028) là học phần bắt buộc thuộc chuyên sâu Công nghệ vi điện tử của Trường Đại học Công nghệ. Điều này được xác nhận từ thông tin trong ngữ cảnh, cụ thể là"
Học phần Đồ họa kỹ thuật thuộc khối kiến thức nào trong chương trình đào tạo ngành Công nghệ Vật liệu của Trường Đại học Công nghệ?,Kiến thức bổ trợ.,Không biết
Tổng số tín chỉ của chương trình đào tạo ngành Công nghệ kỹ thuật điện tử - viễn thông (CLC TT23) tại Trường Đại học Công nghệ là bao nhiêu?,151 tín chỉ.,151 tín chỉ
Sinh viên ngành Công nghệ kỹ thuật điện tử - viễn thông (CLC TT23) tại Trường Đại học Công nghệ cần hoàn thành bao nhiêu tín chỉ khối kiến thức chung?,21 tín chỉ.,21 tín chỉ
Số tín chỉ khối kiến thức theo lĩnh vực của chương trình đào tạo ngành Công nghệ kỹ thuật điện tử - viễn thông (CLC TT23) tại Trường Đại học Công nghệ là bao nhiêu?,22 tín chỉ.,22 tín chỉ
Khối kiến thức theo khối ngành của chương trình đào tạo ngành Công nghệ kỹ thuật điện tử - viễn thông (CLC TT23) tại Trường Đại học Công nghệ gồm bao nhiêu tín chỉ?,10 tín chỉ.,10 tín chỉ
Sinh viên ngành Công nghệ kỹ thuật điện tử - viễn thông (CLC TT23) tại Trường Đại học Công nghệ cần tích lũy bao nhiêu tín chỉ cho khối kiến thức theo nhóm ngành?,33 tín chỉ.,10 tín chỉ
Số tín chỉ của khối kiến thức ngành trong chương trình đào tạo ngành Công nghệ kỹ thuật điện tử - viễn thông (CLC TT23) tại Trường Đại học Công nghệ là bao nhiêu?,65 tín chỉ.,22 tín chỉ
Khối kiến thức thực tập và tốt nghiệp của chương trình đào tạo ngành Công nghệ kỹ thuật điện tử - viễn thông (CLC TT23) tại Trường Đại học Công nghệ chiếm bao nhiêu tín chỉ?,17 tín chỉ.,Không biết
Học phần Kinh tế chính trị Mác - Lênin của Trường Đại học Công nghệ yêu cầu học phần tiên quyết nào?,Triết học Mác – Lênin.,A
Học phần Giải tích 2 của Trường Đại học Công nghệ yêu cầu học phần tiên quyết nào?,Giải tích 1.,Không biết
Học phần Vật lý đại cương 2 của Trường Đại học Công nghệ yêu cầu học phần tiên quyết nào?,Vật lý đại cương 1.,Không biết
Học phần Tín hiệu và hệ thống của Trường Đại học Công nghệ yêu cầu học phần tiên quyết nào?,Giải tích 1.,Không biết
Học phần Cấu trúc dữ liệu và giải thuật của Trường Đại học Công nghệ yêu cầu học phần tiên quyết nào?,Nhập môn lập trình.,Không biết
Học phần Phương pháp tính của Trường Đại học Công nghệ yêu cầu học phần tiên quyết nào?,Đại số và Giải tích 2.,Không biết
Học phần Xử lý tín hiệu số của Trường Đại học Công nghệ yêu cầu học phần tiên quyết nào?,Tín hiệu và hệ thống.,Không biết
Học phần Kỹ thuật điện từ của Trường Đại học Công nghệ yêu cầu học phần tiên quyết nào?,Vật lý đại cương 2.,Không biết
Trang web này thuộc về trường nào?,"Trường Đại học Công nghệ, ĐHQGHN.",Không biết
Nội dung chính của trang web Trường Đại học Công nghệ này là gì?,"Giao lưu, trao đổi sinh viên.",Trường Đại học Công nghệ – ĐHQGHN tổ chức đào tạo các ngành học hiện đại đáp ứng nhu cầu phát triển nguồn nhân lực trong bối cảnh cách mạng công nghiệp lần thứ tư bao gồm các ngành thuộc các lĩnh vực công nghệ
Chương trình trao đổi sinh viên DiscoverNUS kỳ mùa Thu năm 2025 được tổ chức ở đâu?,Đại học Quốc gia Singapore (NUS).,Chương trình trao đổi sinh viên DiscoverNUS kỳ mùa Thu năm 2025 được tổ chức trực tiếp tại cơ sở đào tạo của Đại học Quốc gia Hà Nội. 
Văn bản thông báo về chương trình trao đổi sinh viên DiscoverNUS kỳ mùa Thu năm 2025 của ĐHQGHN có số hiệu bao nhiêu?,983/ĐHQGHN-HT&PT.,983/ĐHQGHN-HT&PT
Đại học Waseda nằm ở quốc gia nào?,Nhật Bản.,Nhật Bản
"Chương trình ""FINSPARK-Unleash your Maverick"" hướng đến đối tượng nào?","Các tài năng trẻ trong lĩnh vực tài chính, công nghệ và đổi mới sáng tạo.","Chương trình ""FINSPARK-Unleash your Maverick"" hướng đến đối tượng là các tài năng trẻ trong lĩnh vực tài chính, công nghệ và đổi mới sáng tạo. Mục đích của chương trình là nuôi dưỡng và kết nối các tài"
"Học viện nào đã gửi công văn về việc tổ chức chương trình ""FINSPARK-Unleash your Maverick""?",Học viện Ngân hàng.,"Trước 15h00,"
Chương trình trao đổi sinh viên/ học viên kỳ mùa Thu năm 2025 được tổ chức tại trường đại học nào ở Nhật Bản?,Đại học Kyoto.,"Chương trình trao đổi sinh viên/ học viên kỳ mùa Thu năm 2025 được tổ chức tại Đại học Kyoto, Nhật Bản. "
Chương trình AsTW là viết tắt của cụm từ gì?,ASEAN in Today’s World.,Thời gian tham dự chương trình AsTW 20
Chương trình AsTW năm 2025 diễn ra trong khoảng thời gian nào?,Từ ngày 17/2/2025 – 27/2/2025.,Từ ngày 17/2/2025 – 27/2/2025 
Diễn đàn giáo dục AUN lần thứ 20 và ASEAN + 3 lần thứ 9 có bao gồm hoạt động nào dành cho sinh viên?,Cuộc thi Hùng biện sinh viên 2024.,Không biết
Văn bản thông báo về chương trình trao đổi sinh viên/ học viên kỳ mùa Xuân năm 2025 tại Đại học Kyoto của ĐHQGHN có số hiệu bao nhiêu?,3861/ĐHQGHN-HT&PT.,A: 3861/ĐHQGHN-HT&PT
Chương trình trao đổi sinh viên tại Đại học Waseda kỳ mùa Xuân trong năm 2025 được ĐHQGHN thông báo vào ngày tháng năm nào?,Ngày 07/08/2024.,Chương trình trao đổi sinh viên tại Đại học Waseda kỳ mùa Xuân trong năm 2025 được ĐHQGHN thông báo vào ngày 07/08/2024. 
Văn bản thông báo về chương trình trao đổi sinh viên tại Đại học Waseda kỳ mùa Xuân trong năm 2025 của ĐHQGHN có số hiệu bao nhiêu?,3693/ĐHQGHN-ĐT.,A: 3693/ĐHQGHN-ĐT
Các chương trình trao đổi sinh viên tại Trường Đại học Công nghệ có dành cho đối tượng học viên không?,Có.,Không biết
Sinh viên tốt nghiệp ngành Cơ kỹ thuật của Trường Đại học Công nghệ cần đạt chuẩn nào?,Chuẩn Khung trình độ Quốc gia Việt Nam theo Quyết định số 1982/QĐ-TTg năm 2016.,- Kỹ năng chuyên môn
Sinh viên tốt nghiệp ngành Cơ kỹ thuật cần có bao nhiêu tín chỉ?,150 tín chỉ.,"150 tín chỉ (không tính các học phần Giáo dục thể chất, Giáo dục quốc phòng - an ninh) "
Sinh viên tốt nghiệp ngành Cơ kỹ thuật của Trường Đại học Công nghệ cần đạt bậc mấy trong khung trình độ giáo dục quốc gia?,Bậc 6/8.,Không biết
Chuẩn đầu ra về ngoại ngữ của sinh viên ngành Cơ kỹ thuật là gì?,Tương đương bậc 3 theo khung năng lực ngoại ngữ 6 bậc dùng cho Việt Nam.,Chuẩn đầu ra về ngoại ngữ của sinh viên ngành Cơ kỹ thuật là:
Sinh viên tốt nghiệp ngành Cơ kỹ thuật có thể làm việc ở những lĩnh vực nào?,"Cơ khí, Xây dựng, Giao thông, Thủy lợi, Môi trường, Dầu khí…",Sinh viên tốt nghiệp ngành Cơ kỹ thuật sau khi ra trường có thể làm việc ở những lĩnh vực sau:
Sinh viên tốt nghiệp ngành Cơ kỹ thuật có thể làm việc ở những vị trí nào?,"Kỹ sư kỹ thuật, chuyên viên phân tích, nghiên cứu viên và giảng viên.",Sinh viên tốt nghiệp ngành Cơ kỹ thuật sau khi ra trường có thể làm việc ở những vị trí như sau:
Sinh viên tốt nghiệp ngành Cơ kỹ thuật có thể tiếp tục học ở bậc học nào?,Bậc sau đại học các chuyên ngành thuộc lĩnh vực Cơ kỹ thuật.,Sinh viên tốt nghiệp ngành Cơ kỹ thuật có thể tiếp tục học ở bậc sau đại học các chuyên ngành thuộc lĩnh vực Cơ kỹ thuật và Nghiên cứu triển khai các ứng dụng của ngành cơ kỹ thuật trong thực tế.
Kiến thức nào được bổ sung cho sinh viên Cơ kỹ thuật thuộc lĩnh vực công nghệ?,"Mạng máy tính, quản lý và chuyên nghiệp trong công nghệ; công nghệ phần mềm, vật liệu tiên tiến trong công nghệ.",Kiến thức bổ trợ
Sinh viên ngành Cơ kỹ thuật định hướng chuyên sâu về Thủy khí công nghiệp và môi trường sẽ làm gì?,"Vận dụng kiến thức vào tính toán, đánh giá, phân tích các quá trình thủy khí động lực ứng dụng trong công nghiệp và môi trường.",Sinh viên ngành Cơ kỹ thuật định hướng chuyên sâu về Thủy khí công nghiệp và môi trường sẽ:
Sinh viên ngành Cơ kỹ thuật định hướng chuyên sâu về Cơ học kỹ thuật biển sẽ làm gì?,"Mô phỏng, phân tích, đánh giá các công trình ngoài khơi và ven bờ, tính toán, mô phỏng, đánh giá, dự báo các quá trình thủy thạch động lực và môi trường biển.",Sinh viên ngành Cơ kỹ thuật định hướng chuyên sâu về Cơ học kỹ thuật biển sẽ:
Sinh viên ngành Cơ điện tử cần có khả năng gì?,Đánh giá phân tích thiết kế hệ thống hoặc quá trình; sử dụng các công cụ hiện đại để phát triển các hệ thống cơ điện tử.,- Biết phát hiện vấn đề và mối tương quan giữa các vấn đề trong lĩnh vực công nghệ cơ điện tử;
Sinh viên ngành Cơ khí chuyên sâu về Công nghệ vũ trụ cần có kiến thức gì?,"Khí động lực học và công nghệ phóng đẩy, cơ học cấu trúc, cơ học bay, công nghệ vệ tinh.",Tôi không biết
Sinh viên tốt nghiệp ngành Cơ kỹ thuật có cần kỹ năng quản lý dự án không?,Có.,"Có, sinh viên tốt nghiệp ngành Cơ kỹ thuật cần kỹ năng quản lý dự án. Theo ngữ cảnh, họ có thể làm việc trong các vị trí như Kỹ sư kỹ thuật, thiết kế, quản lý nhóm, dự án, và cần"
Sinh viên tốt nghiệp ngành Cơ kỹ thuật cần có phẩm chất đạo đức nào?,"Trung thực, lễ độ, khiêm tốn, nhiệt tình, có trách nhiệm với công việc, trung thành với tổ chức, có trách nhiệm với xã hội, tuân thủ luật pháp, có ý thức phục vụ, nhiệt tình tham gia các hoạt động xã hội.","- Trung thực, khách quan, thúc đẩy công bằng và nhân đạo"
"Sau khi tốt nghiệp ngành Cơ khí kỹ thuật, sinh viên có thể làm việc ở đâu?","Các công trình xây dựng, các nhà máy cơ khí chế tạo, nhà máy thủy điện, điện hạt nhân, cũng như các doanh nghiệp liên quan đến xây dựng, giao thông, cơ sở hạ tầng.",Sinh viên tốt nghiệp ngành Cơ khí kỹ thuật sau khi ra trường có thể làm việc ở những vị trí như sau:
Tên đầy đủ của trường được đề cập trong văn bản là gì?,"Trường Đại học Công nghệ, Đại học Quốc gia Hà Nội.",Không biết
Văn bằng tốt nghiệp của ngành Trí tuệ nhân tạo là gì?,Không được đề cập rõ ràng trong văn bản.,Cử nhân ngành Trí tuệ nhân tạo
Sinh viên tốt nghiệp ngành Trí tuệ nhân tạo có thể học lên bậc học nào?,"Thạc sỹ, tiến sĩ.","Sinh viên tốt nghiệp ngành Trí tuệ nhân tạo có thể tiếp tục học bậc sau đại học các chuyên ngành thuộc lĩnh vực Robot, Điều khiển và Tự động hóa, Điện tử – Viễn thông, Cơ Điện tử, Công nghệ"
"Người tốt nghiệp ngành Trí tuệ nhân tạo có thể làm việc ở vị trí nào trong môi trường quản lý, sản xuất, kinh doanh?","Cán bộ thiết kế, phát triển và bảo trì các hệ thống TTNT&KHDL; Cán bộ nghiên cứu phát triển (R&D); Cán bộ quản lý các hệ thống ứng dụng TTNT.","Cán bộ thiết kế, phát triển và bảo trì các hệ thống trí tuệ nhân tạo và khoa học dữ liệu; Cán bộ nghiên cứu phát triển (R&D) tại các công ty, tập đoàn công nghệ; cán bộ quản"
Người tốt nghiệp ngành Trí tuệ nhân tạo có thể làm việc ở vị trí nào trong môi trường học thuật?,"Trợ giảng, giảng viên, nghiên cứu viên.","Trợ giảng, giảng viên, nghiên cứu viên tại các trường đại học, viện nghiên cứu. "
Sinh viên ngành Trí tuệ nhân tạo cần có kỹ năng ngoại ngữ ở mức độ nào?,Tương đương năng lực ngoại ngữ bậc 3/6 trong Khung năng lực ngoại ngữ Việt Nam.,"Sinh viên ngành Trí tuệ nhân tạo cần có kỹ năng ngoại ngữ ở mức độ tương đương với yêu cầu của chương trình cao học Khoa học Cơ bản và Kỹ thuật, Cao học Khoa học Sáng tạo và"
Sinh viên ngành Trí tuệ nhân tạo có cần kiến thức về khoa học xã hội không?,Có.,"Có, sinh viên ngành Trí tuệ nhân tạo cần kiến thức về khoa học xã hội. Theo ngữ cảnh, sinh viên được trang bị kiến thức tổng hợp về toán, khoa học tự nhiên, khoa học xã hội và"
Sinh viên ngành Trí tuệ nhân tạo cần có kiến thức về khoa học chính trị và pháp luật không?,Có.,Không
"Sinh viên ngành Trí tuệ nhân tạo cần có kiến thức về văn hóa, xã hội và nhân văn không?",Có.,Có
Sinh viên ngành Trí tuệ nhân tạo cần có kiến thức về rèn luyện thể chất và quốc phòng không?,Có.,Tôi không biết
Sinh viên ngành Trí tuệ nhân tạo có cần khả năng làm việc độc lập không?,Có.,"Có, sinh viên ngành Trí tuệ nhân tạo cần có khả năng làm việc độc lập. Điều này được nêu rõ trong ngữ cảnh: ""Sinh viên thuộc chương trình Trí tuệ nhân tạo sẽ được trang bị các kiến"
Sinh viên ngành Trí tuệ nhân tạo có cần khả năng tự lập kế hoạch không?,Có.,"Có, sinh viên ngành Trí tuệ nhân tạo được trang bị các kỹ năng cần thiết để tự học, tự thích nghi và làm việc độc lập, phù hợp với xu hướng toàn cầu hóa và yêu cầu của thị trường lao động"
Sinh viên ngành Trí tuệ nhân tạo có cần tuân thủ đạo đức nghề nghiệp không?,Có.,"Có, sinh viên ngành Trí tuệ nhân tạo cần tuân thủ đạo đức nghề nghiệp. Theo ngữ cảnh, sinh viên tốt nghiệp ngành Trí tuệ nhân tạo có phẩm chất đạo đức cá nhân tốt, chuẩn mực trong lời nói"
"Sinh viên ngành Trí tuệ nhân tạo có cần kiến thức về Toán học, khoa học cơ bản và CNTT không?",Có.,Có
Sinh viên ngành Trí tuệ nhân tạo có cần khả năng sử dụng các ngôn ngữ lập trình không?,Có.,"Có, sinh viên ngành Trí tuệ nhân tạo cần phải có khả năng sử dụng các ngôn ngữ lập trình. Theo thông tin được cung cấp, sinh viên sẽ được trang bị ""Lập trình thành thạo một số ngôn ngữ"
Sinh viên tốt nghiệp ngành Công nghệ Hàng không Vũ trụ cần có kiến thức về những lĩnh vực khoa học công nghệ nào?,Sinh viên tốt nghiệp ngành Công nghệ Hàng không Vũ trụ cần có kiến thức thực tế vững chắc và kiến thức lý thuyết chuyên sâu trong nhiều lĩnh vực khoa học công nghệ.,"Sinh viên tốt nghiệp ngành Công nghệ Hàng không Vũ trụ cần có kiến thức về nhiều lĩnh vực khoa học công nghệ, bao gồm:"
Sinh viên tốt nghiệp ngành Công nghệ Hàng không Vũ trụ cần đạt bậc mấy theo Khung năng lực ngoại ngữ 6 bậc dùng cho Việt Nam?,Sinh viên tốt nghiệp ngành Công nghệ Hàng không Vũ trụ cần đạt chuẩn tương đương bậc 3 theo Khung năng lực ngoại ngữ 6 bậc dùng cho Việt Nam (B1).,Không biết
Sinh viên ngành Công nghệ Hàng không Vũ trụ cần vận dụng kiến thức nào để học tập và nghiên cứu các học phần khác của các ngành kỹ thuật và công nghệ?,Sinh viên ngành Công nghệ Hàng không Vũ trụ cần vận dụng kiến thức vật lý để học tập và nghiên cứu các học phần khác của các ngành kỹ thuật và công nghệ.,Không có thông tin cụ thể trong ngữ cảnh về việc sinh viên ngành Công nghệ Hàng không Vũ trụ cần vận dụng kiến thức nào để học tập và nghiên cứu các học phần khác của các ngành kỹ thuật và công nghệ. 
Sinh viên ngành Công nghệ Hàng không Vũ trụ cần có khả năng phân tích và lập trình ngôn ngữ lập trình nào?,Sinh viên ngành Công nghệ Hàng không Vũ trụ cần có khả năng phân tích và lập trình một ngôn ngữ lập trình.,"Sinh viên ngành Công nghệ Hàng không Vũ trụ cần có khả năng phân tích và lập trình các ngôn ngữ lập trình nhúng trong hệ thống điều khiển, đặc biệt là các ngôn ngữ lập trình nhúng trong hệ thống điều khiển của thiết bị"
Sinh viên ngành Công nghệ Hàng không Vũ trụ cần hiểu biết về phương pháp tính toán số nào trong kỹ thuật?,Sinh viên ngành Công nghệ Hàng không Vũ trụ cần hiểu biết về phương pháp tính toán số trong kỹ thuật.,"Sinh viên ngành Công nghệ Hàng không Vũ trụ cần hiểu và vận dụng được các phương pháp tính toán số trong kỹ thuật, bao gồm việc tính toán hoặc giải số các bài toán trong khoa học kỹ thuật trên máy tính. Cụ"
"Sinh viên ngành Công nghệ Hàng không Vũ trụ cần nắm vững kiến thức cơ bản về lĩnh vực nào trong kỹ thuật điện, điện tử?","Sinh viên ngành Công nghệ Hàng không Vũ trụ cần nắm vững kiến thức cơ bản trong kỹ thuật điện, điện tử thông dụng.","Sinh viên ngành Công nghệ Hàng không Vũ trụ cần nắm vững kiến thức cơ bản về kỹ thuật điện, điện tử thông dụng, bao gồm:"
Sinh viên ngành Công nghệ Hàng không Vũ trụ cần nắm được kiến thức cơ sở về ngành nào trong nhiệt động lực học?,"Sinh viên ngành Công nghệ Hàng không Vũ trụ cần nắm được kiến thức cơ sở về nhiệt động lực học, các động cơ nhiệt, quy luật nhiệt động học cân bằng.","Sinh viên ngành Công nghệ Hàng không Vũ trụ cần nắm được kiến thức cơ sở về nhiệt động lực học, các động cơ nhiệt, quy luật nhiệt động học cân bằng, và các định luật liên quan. "
Sinh viên ngành Công nghệ Hàng không Vũ trụ cần có kiến thức cơ bản về hệ thống nào để phân tích các yêu cầu và các yếu tố ảnh hưởng?,"Sinh viên ngành Công nghệ Hàng không Vũ trụ cần có kiến thức cơ bản về hệ thống điều khiển, biết phân tích các yêu cầu và các yếu tố ảnh hưởng.",Sinh viên ngành Công nghệ Hàng không Vũ trụ cần có kiến thức cơ bản về hệ thống điều khiển để phân tích các yêu cầu và các yếu tố ảnh hưởng. 
Định hướng Công nghệ thông tin và Điện tử Hàng không trang bị kiến thức cơ bản về lĩnh vực nào liên quan đến không gian?,"Định hướng Công nghệ thông tin và Điện tử Hàng không trang bị kiến thức cơ bản về viễn thám, hệ thống thông tin địa lý.",Tôi không biết
Định hướng Công nghệ thông tin và Điện tử Hàng không cần nắm vững kiến thức về lĩnh vực nào trong các hệ thống phần mềm?,"Định hướng Công nghệ thông tin và Điện tử Hàng không cần nắm vững kiến thức về đảm bảo an toàn, an ninh cho các hệ thống phần mềm trong lĩnh vực Hàng không Vũ trụ.",Không biết
