question,answer
Tên tiếng Việt của ngành Hệ thống thông tin (CLC TT23) tại Trường Đại học Công nghệ là gì?,Hệ thống thông tin
Tên tiếng Anh của ngành Hệ thống thông tin (CLC TT23) tại Trường Đại học Công nghệ là gì?,Information Systems
Mã số đào tạo của ngành Hệ thống thông tin (CLC TT23) tại Trường Đại học Công nghệ là gì?,7480104
Danh hiệu tốt nghiệp của sinh viên ngành Hệ thống thông tin (CLC TT23) tại Trường Đại học Công nghệ là gì?,Cử nhân
Thời gian đào tạo ngành Hệ thống thông tin (CLC TT23) tại Trường Đại học Công nghệ là bao lâu?,4 năm
Sinh viên tốt nghiệp ngành Hệ thống thông tin (CLC TT23) tại Trường Đại học Công nghệ nhận văn bằng gì?,Cử nhân Hệ thống thông tin
Chương trình Hệ thống thông tin (CLC TT23) tại Trường Đại học Công nghệ thuộc hệ đào tạo nào?,Chất lượng cao
Mục tiêu của chương trình Hệ thống thông tin (CLC TT23) tại Trường Đại học Công nghệ là gì?,Đào tạo nhân lực chất lượng cao và bồi dưỡng nhân tài trình độ đại học ngành HTTT trong thời đại số hóa.
Chương trình Hệ thống thông tin (CLC TT23) tại Trường Đại học Công nghệ định hình theo mấy hướng chuyên sâu?,Hai
Hai hướng chuyên sâu của chương trình Hệ thống thông tin (CLC TT23) tại Trường Đại học Công nghệ là gì?,Tích hợp dịch vụ và quản lý dữ liệu lớn và Khoa học dữ liệu và phân tích kinh doanh
Hình thức tuyển sinh của Trường Đại học Công nghệ đối với ngành Hệ thống thông tin (CLC TT23) như thế nào?,Theo quy định của Đại học Quốc gia Hà Nội.
Dự kiến quy mô tuyển sinh hàng năm của ngành Hệ thống thông tin (CLC TT23) tại Trường Đại học Công nghệ là bao nhiêu?,60 sinh viên/năm.
Chương trình Hệ thống thông tin (CLC TT23) tại Trường Đại học Công nghệ trang bị kỹ năng giao tiếp tiếng Anh ở bậc nào?,Bậc 4/6 theo khung năng lực ngoại ngữ 6 bậc dùng cho Việt Nam.
Sinh viên tốt nghiệp ngành Hệ thống thông tin (CLC TT23) tại Trường Đại học Công nghệ cần có phẩm chất đạo đức như thế nào?,"Tinh thần trách nhiệm với bản thân, gia đình, tổ chức và xã hội, về tinh thần phụng sự đất nước Việt Nam phát triển phồn vinh và hạnh phúc."
