question,answer
Tên tiếng Việt của ngành đào tạo được nhắc đến trong văn bản là gì?,Kỹ thuật năng lượng
Tên tiếng Anh của ngành Kỹ thuật năng lượng là gì?,Energy Engineering
Mã ngành đào tạo Kỹ thuật năng lượng là bao nhiêu?,7520406
Danh hiệu tốt nghiệp của sinh viên ngành Kỹ thuật năng lượng là gì?,Kỹ sư
Thời gian đào tạo ngành Kỹ thuật năng lượng của Trường Đại học Công nghệ là bao lâu?,"4,5 năm"
Văn bằng tốt nghiệp ngành Kỹ thuật năng lượng bằng tiếng Việt là gì?,Kỹ sư ngành Kỹ thuật Năng lượng
Văn bằng tốt nghiệp ngành Kỹ thuật Năng lượng bằng tiếng Anh là gì?,The Degree of Engineer in Energy Engineering
Kỹ sư tốt nghiệp ngành Kỹ thuật Năng lượng có thể đảm nhận vị trí nào?,"Kỹ sư về quản lý năng lượng, quản lý kỹ thuật, quản lý sản xuất, thiết kế dây chuyền, chuyên giao công nghệ, ứng dụng thiết bị công nghệ mới."
Sinh viên tốt nghiệp ngành Kỹ thuật năng lượng cần có kiến thức gì?,"Kiến thức đa ngành về khoa học cơ bản, khoa học vật liệu, vật lý và tin học."
Sinh viên tốt nghiệp ngành Kỹ thuật năng lượng cần có kỹ năng gì?,Kỹ năng sử dụng thành thạo các công cụ định lượng và các phần mềm chuyên dụng.
Mục tiêu MT4 của chương trình đào tạo ngành Kỹ thuật năng lượng là gì?,"Năng lực tự học, tự nghiên cứu, tích lũy kinh nghiệm để nâng cao trình độ chuyên môn phù hợp với nhu cầu xã hội và thích nghi với các môi trường làm việc khác nhau."
Trường Đại học Công nghệ tuyển sinh ngành Kỹ thuật năng lượng theo quy chế của ai?,"Bộ Giáo dục và Đào tạo, Đại học Quốc gia Hà Nội và Đề án tuyển sinh hằng năm của Trường Đại học Công nghệ."
