question,answer
Chương trình đào tạo ngành Kỹ thuật điều khiển và tự động hóa trên website này dành cho khóa nào?,QH-2022 trở đi và QH-2019 trở đi.
Trang web này cung cấp thông tin gì về chương trình đào tạo ngành Kỹ thuật điều khiển và tự động hóa?,"Giới thiệu chung, chuẩn đầu ra và nội dung chương trình đào tạo."
Trường nào chịu trách nhiệm đào tạo ngành Kỹ thuật điều khiển và tự động hóa này?,"Trường Đại học Công nghệ, ĐHQGHN."
Tên tiếng Anh của Trường Đại học Công nghệ là gì?,Univeristy of Engineering and Technology
Website này có phải là trang chủ của Trường Đại học Công nghệ không?,"Có, đây là trang thông tin của Trường Đại học Công nghệ, ĐHQGHN."
Chương trình đào tạo ngành Kỹ thuật điều khiển và tự động hóa này có bao gồm thông tin về chuẩn đầu ra không?,"Có, chương trình đào tạo có bao gồm thông tin về chuẩn đầu ra."
Nội dung chương trình đào tạo ngành Kỹ thuật điều khiển và tự động hóa có được công khai trên website không?,"Có, nội dung chương trình đào tạo được công khai."
Thông tin giới thiệu chung về ngành Kỹ thuật điều khiển và tự động hóa có trên trang web này không?,"Có, trang web có phần giới thiệu chung về ngành."
Website này có cung cấp khung chương trình đào tạo chi tiết của ngành Kỹ thuật điều khiển và tự động hóa không?,"Có, thông tin về nội dung chương trình đào tạo được cung cấp."
Chương trình đào tạo ngành Kỹ thuật điều khiển và tự động hóa áp dụng cho các khóa khác nhau có giống nhau không?,"Không, chương trình đào tạo khác nhau cho khóa QH-2022 trở đi và QH-2019 trở đi."
Ngành Kỹ thuật điều khiển và tự động hóa thuộc khoa nào của Trường Đại học Công nghệ?,"(Không có thông tin, cần bổ sung)"
Văn bằng tốt nghiệp ngành Kỹ thuật điều khiển và tự động hóa là gì?,"(Không có thông tin, cần bổ sung)"
Thời gian đào tạo ngành Kỹ thuật điều khiển và tự động hóa là bao lâu?,"(Không có thông tin, cần bổ sung)"
Hình thức đào tạo của ngành Kỹ thuật điều khiển và tự động hóa là gì?,"(Không có thông tin, cần bổ sung)"
Mã ngành của ngành Kỹ thuật điều khiển và tự động hóa là gì?,"(Không có thông tin, cần bổ sung)"
